HC_ID,Date,date,month,day,year,proposal,status_result,text,Link,article_source_id,status_extra,From,from_name,from_latitude,from_longitude,from_adm1_code_full,from_adm1_nr,from_adm1_name,from_country_code,To,to_name,to_latitude,to_longitude,to_adm1_code_full,to_adm1_nr,to_adm1_name,to_country_code
1,05.03.22,2022-03-05,3,5,2022,Agreed,disputed,"Status: disputed; MOSCOW. March 5 (Interfax) - Russian forces have declared the opening of humanitarian passages at 10 a.m. Moscow time on Saturday and a ceasefire that would enable civilians to leave Mariupol and Volnovakha. ""Humanitarian passages and exit routes have been coordinated with the Ukrainian side,"" the ministry said. ;;;; KYIV. March 5 (Interfax-Ukraine) - Pavlo Kyrylenko, head of the Donetsk regional military-civilian administration (subordinated to Kyiv), has said he can confirm that a ceasefire has been agreed to facilitate the evacuation of residents of Volnovakha and Mariupol starting 9:00 a.m. Kyiv Time (10:00 a.m. Moscow Time). ;;;;; KYIV. March 5 (Interfax-Ukraine) - Pavlo Kyrylenko, head of the Donetsk regional military-civilian administration (subordinated to Kyiv), has announced the establishment of a ceasefire from 9:00 a.m. to 4:00 p.m. Kyiv Time (10:00 a.m. to 17:00 a.m. Moscow Time), with the evacuation of civilians from Mariupol starting at 11:00 a.m. Kyiv Time.""Officially. A humanitarian corridor has been established along the following route: Mariupol - Mykilske - Rozivka - Polohy - Orikhiv - Zaporizhzhya,"" Kyrylenko wrote on his Telegram channel on Saturday morning. KYIV. March 5 (Interfax-Ukraine) - Ukrainian Deputy Prime Minister and Minister for Reintegration of Temporarily Occupied Territories Iryna Vereshchuk has announced the establishment of a humanitarian corridor from Volnovakha and Mariupol to evacuate local civilians.
 ""Via the International Committee of the Red Cross's (ICRC) mediation, we agreed upon the routes, the movement of a column, and a plan for the delivery of humanitarian cargo, and we have obtained confirmation from the Russian side,"" Vereshchuk said at a press briefing on Saturday.
 Ukraine plans to evacuate over 200,000 people along the Mariupol - Mykilske - Rozivka - Bilmak - Polohe - Orikhiv - Zaporizhzhya route and over 15,000 people along the Volnovakha - Valeryanivka - Novoandriyivka - Kyrylivka - Vuhledar - Pokrovsk - Zaporizhzhya route, Vereshchuk said.
 The ICRC is acting as a guarantor of the ceasefire during the evacuation, Vereshchuk said.  see source: https://interfax.com/newsroom/top-stories/75561/?sphrase_id=79069 ;;;; https://interfax.com/newsroom/top-stories/75577/?sphrase_id=79069 ;;; https://interfax.com/newsroom/top-stories/75579/?sphrase_id=79069 ;;; https://interfax.com/newsroom/top-stories/75602/?sphrase_id=79069 ;;;; https://interfax.com/newsroom/top-stories/75616/?sphrase_id=79069",https://interfax.com/newsroom/top-stories/75561/?sphrase_id=79069 ;;;; https://interfax.com/newsroom/top-stories/75577/?sphrase_id=79069 ;;; https://interfax.com/newsroom/top-stories/75579/?sphrase_id=79069 ;;; https://interfax.com/newsroom/top-stories/75602/?sphrase_id=79069 ;;;; https://interfax.com/newsroom/top-stories/75616/?sphrase_id=79069,src-64,disputed,Mariupol,Mariupol,47.09514,37.54131,UA.05,5,Donetsk Oblast,UA,Zaporizhzhya,Zaporizhzhya,47.85167,35.11714,UA.26,26,Zaporizhzhya Oblast,UA
2,05.03.22,2022-03-05,3,5,2022,Agreed,disputed,"Status: disputed; MOSCOW. March 5 (Interfax) - Russian forces have declared the opening of humanitarian passages at 10 a.m. Moscow time on Saturday and a ceasefire that would enable civilians to leave Mariupol and Volnovakha. ""Humanitarian passages and exit routes have been coordinated with the Ukrainian side,"" the ministry said. ;;;; KYIV. March 5 (Interfax-Ukraine) - Pavlo Kyrylenko, head of the Donetsk regional military-civilian administration (subordinated to Kyiv), has said he can confirm that a ceasefire has been agreed to facilitate the evacuation of residents of Volnovakha and Mariupol starting 9:00 a.m. Kyiv Time (10:00 a.m. Moscow Time). ;;;;; KYIV. March 5 (Interfax-Ukraine) - Pavlo Kyrylenko, head of the Donetsk regional military-civilian administration (subordinated to Kyiv), has announced the establishment of a ceasefire from 9:00 a.m. to 4:00 p.m. Kyiv Time (10:00 a.m. to 17:00 a.m. Moscow Time), with the evacuation of civilians from Mariupol starting at 11:00 a.m. Kyiv Time.""Officially. A humanitarian corridor has been established along the following route: Mariupol - Mykilske - Rozivka - Polohy - Orikhiv - Zaporizhzhya,"" Kyrylenko wrote on his Telegram channel on Saturday morning. KYIV. March 5 (Interfax-Ukraine) - Ukrainian Deputy Prime Minister and Minister for Reintegration of Temporarily Occupied Territories Iryna Vereshchuk has announced the establishment of a humanitarian corridor from Volnovakha and Mariupol to evacuate local civilians.
 ""Via the International Committee of the Red Cross's (ICRC) mediation, we agreed upon the routes, the movement of a column, and a plan for the delivery of humanitarian cargo, and we have obtained confirmation from the Russian side,"" Vereshchuk said at a press briefing on Saturday.
 Ukraine plans to evacuate over 200,000 people along the Mariupol - Mykilske - Rozivka - Bilmak - Polohe - Orikhiv - Zaporizhzhya route and over 15,000 people along the Volnovakha - Valeryanivka - Novoandriyivka - Kyrylivka - Vuhledar - Pokrovsk - Zaporizhzhya route, Vereshchuk said.
 The ICRC is acting as a guarantor of the ceasefire during the evacuation, Vereshchuk said.  see source: https://interfax.com/newsroom/top-stories/75561/?sphrase_id=79069 ;;;; https://interfax.com/newsroom/top-stories/75577/?sphrase_id=79069 ;;; https://interfax.com/newsroom/top-stories/75579/?sphrase_id=79069 ;;; https://interfax.com/newsroom/top-stories/75602/?sphrase_id=79069 ;;;; https://interfax.com/newsroom/top-stories/75616/?sphrase_id=79070",https://interfax.com/newsroom/top-stories/75561/?sphrase_id=79069 ;;;; https://interfax.com/newsroom/top-stories/75577/?sphrase_id=79069 ;;; https://interfax.com/newsroom/top-stories/75579/?sphrase_id=79069 ;;; https://interfax.com/newsroom/top-stories/75602/?sphrase_id=79069 ;;;; https://interfax.com/newsroom/top-stories/75616/?sphrase_id=79070,src-208,disputed,Volnovakha,Volnovakha,47.60103,37.49674,UA.05,5,Donetsk Oblast,UA,Zaporizhzhya,Zaporizhzhya,47.85167,35.11714,UA.26,26,Zaporizhzhya Oblast,UA
5,07.03.22,2022-03-07,3,7,2022,Russia,proposed route/outcome unknown,"Status: proposed route/outcome unknown; MOSCOW. March 7 (Interfax) - Russia has declared a ceasefire starting 10:00 a.m. on March 7 and will open humanitarian corridors for the evacuation of civilians from Kyiv, Mariupol, Kharkiv, and Sumy, the Russian interagency humanitarian response staff in Ukraine said on Monday. ;;;;; MOSCOW. March 7 (Interfax) - The Russian military has accused Ukrainian nationalists of disrupting the work of humanitarian corridors. ""We monitored closely using objective control means, including drones, no practical events to prepare humanitarian convoys were conducted, no one came to the opened humanitarian corridors,"" Col. Gen. Mikhail Mizintsev, the head of the Russian National Defense Control Center, said. ""It has been established that nationalists are just not letting civilians and foreign citizens out of the said populated areas under threat of physical violence,"" Mizintsev said.  see source: https://interfax.com/newsroom/top-stories/75807/?sphrase_id=79069 ;;;; https://interfax.com/newsroom/top-stories/75822/?sphrase_id=79069 ;;;; https://interfax.com/newsroom/top-stories/75842/?sphrase_id=79069 ;;; https://inews.co.uk/news/what-is-humanitarian-corridor-meaning-why-putin-offering-evacuate-ukraine-russia-belarus-1501680?ico=in-line_link",https://interfax.com/newsroom/top-stories/75807/?sphrase_id=79069 ;;;; https://interfax.com/newsroom/top-stories/75822/?sphrase_id=79069 ;;;; https://interfax.com/newsroom/top-stories/75842/?sphrase_id=79069 ;;; https://inews.co.uk/news/what-is-humanitarian-corridor-meaning-why-putin-offering-evacuate-ukraine-russia-belarus-1501680?ico=in-line_link,src-174,proposed route/outcome unknown,Kyiv,Kyiv,50.45466,30.5238,UA.12,12,Kyiv City,UA,Gomel (Belarus) to be transfered to Russia by air,,52.43652,30.96949,,,,BY
6,07.03.22,2022-03-07,3,7,2022,Russia,disputed,"Status: disputed; MOSCOW. March 7 (Interfax) - Russia has declared a ceasefire starting 10:00 a.m. on March 7 and will open humanitarian corridors for the evacuation of civilians from Kyiv, Mariupol, Kharkiv, and Sumy, the Russian interagency humanitarian response staff in Ukraine said on Monday. ;;;;; MOSCOW. March 7 (Interfax) - The Russian military has accused Ukrainian nationalists of disrupting the work of humanitarian corridors. ""We monitored closely using objective control means, including drones, no practical events to prepare humanitarian convoys were conducted, no one came to the opened humanitarian corridors,"" Col. Gen. Mikhail Mizintsev, the head of the Russian National Defense Control Center, said. ""It has been established that nationalists are just not letting civilians and foreign citizens out of the said populated areas under threat of physical violence,"" Mizintsev said.  see source: https://interfax.com/newsroom/top-stories/75807/?sphrase_id=79069",https://interfax.com/newsroom/top-stories/75807/?sphrase_id=79069,src-13,disputed,Mariupol,Mariupol,47.09514,37.54131,UA.05,5,Donetsk Oblast,UA,"Rostov-on-Don, from where people would be transported by air, by train, or by bus to planned destinations or temporary accommodation centers",,47.23333,39.7,,,,RU
7,07.03.22,2022-03-07,3,7,2022,Russia,disputed,"Status: disputed; MOSCOW. March 7 (Interfax) - Russia has declared a ceasefire starting 10:00 a.m. on March 7 and will open humanitarian corridors for the evacuation of civilians from Kyiv, Mariupol, Kharkiv, and Sumy, the Russian interagency humanitarian response staff in Ukraine said on Monday. ;;;;; MOSCOW. March 7 (Interfax) - The Russian military has accused Ukrainian nationalists of disrupting the work of humanitarian corridors. ""We monitored closely using objective control means, including drones, no practical events to prepare humanitarian convoys were conducted, no one came to the opened humanitarian corridors,"" Col. Gen. Mikhail Mizintsev, the head of the Russian National Defense Control Center, said. ""It has been established that nationalists are just not letting civilians and foreign citizens out of the said populated areas under threat of physical violence,"" Mizintsev said.  see source: https://interfax.com/newsroom/top-stories/75807/?sphrase_id=79069",https://interfax.com/newsroom/top-stories/75807/?sphrase_id=79069,src-13,disputed,Mariupol,Mariupol,47.09514,37.54131,UA.05,5,Donetsk Oblast,UA,Zaporizhzhya,Zaporizhzhya,47.85167,35.11714,UA.26,26,Zaporizhzhya Oblast,UA
8,07.03.22,2022-03-07,3,7,2022,Russia,disputed,"Status: disputed; MOSCOW. March 7 (Interfax) - Russia has declared a ceasefire starting 10:00 a.m. on March 7 and will open humanitarian corridors for the evacuation of civilians from Kyiv, Mariupol, Kharkiv, and Sumy, the Russian interagency humanitarian response staff in Ukraine said on Monday. ;;;;; MOSCOW. March 7 (Interfax) - The Russian military has accused Ukrainian nationalists of disrupting the work of humanitarian corridors. ""We monitored closely using objective control means, including drones, no practical events to prepare humanitarian convoys were conducted, no one came to the opened humanitarian corridors,"" Col. Gen. Mikhail Mizintsev, the head of the Russian National Defense Control Center, said. ""It has been established that nationalists are just not letting civilians and foreign citizens out of the said populated areas under threat of physical violence,"" Mizintsev said.  see source: https://interfax.com/newsroom/top-stories/75807/?sphrase_id=79069",https://interfax.com/newsroom/top-stories/75807/?sphrase_id=79069,src-13,disputed,Kharkiv,Kharkiv,49.98081,36.25272,UA.07,7,Kharkiv,UA,"Belgorod, from where they would be transported by air, by train, or by bus to planned destinations or temporary accommodation centers",,50.61074,36.58015,,,,RU
9,07.03.22,2022-03-07,3,7,2022,Russia,disputed,"Status: disputed; MOSCOW. March 7 (Interfax) - Russia has declared a ceasefire starting 10:00 a.m. on March 7 and will open humanitarian corridors for the evacuation of civilians from Kyiv, Mariupol, Kharkiv, and Sumy, the Russian interagency humanitarian response staff in Ukraine said on Monday. ;;;;; MOSCOW. March 7 (Interfax) - The Russian military has accused Ukrainian nationalists of disrupting the work of humanitarian corridors. ""We monitored closely using objective control means, including drones, no practical events to prepare humanitarian convoys were conducted, no one came to the opened humanitarian corridors,"" Col. Gen. Mikhail Mizintsev, the head of the Russian National Defense Control Center, said. ""It has been established that nationalists are just not letting civilians and foreign citizens out of the said populated areas under threat of physical violence,"" Mizintsev said.  see source: https://interfax.com/newsroom/top-stories/75807/?sphrase_id=79069",https://interfax.com/newsroom/top-stories/75807/?sphrase_id=79069,src-13,disputed,Sumy,Sumy,50.9216,34.80029,UA.21,21,Sumy,UA,"Belgorod, from where people would be transported by air, by train, or by bus to planned destinations or temporary accommodation centers",,50.61074,36.58015,,,,RU
10,07.03.22,2022-03-07,3,7,2022,Russia,disputed,"Status: disputed; MOSCOW. March 7 (Interfax) - Russia has declared a ceasefire starting 10:00 a.m. on March 7 and will open humanitarian corridors for the evacuation of civilians from Kyiv, Mariupol, Kharkiv, and Sumy, the Russian interagency humanitarian response staff in Ukraine said on Monday. ;;;;; MOSCOW. March 7 (Interfax) - The Russian military has accused Ukrainian nationalists of disrupting the work of humanitarian corridors. ""We monitored closely using objective control means, including drones, no practical events to prepare humanitarian convoys were conducted, no one came to the opened humanitarian corridors,"" Col. Gen. Mikhail Mizintsev, the head of the Russian National Defense Control Center, said. ""It has been established that nationalists are just not letting civilians and foreign citizens out of the said populated areas under threat of physical violence,"" Mizintsev said.  see source: https://interfax.com/newsroom/top-stories/75807/?sphrase_id=79069",https://interfax.com/newsroom/top-stories/75807/?sphrase_id=79069,src-13,disputed,Sumy,Sumy,50.9216,34.80029,UA.21,21,Sumy,UA,Poltava,Poltava,49.62417,38.12374,UA.14,14,Luhansk,UA
16,09.03.22,2022-03-09,3,9,2022,Agreed,proposed route/outcome unknown,"Status: proposed route/outcome unknown; MOSCOW. March 8 (Interfax) - Russia will declare a temporary ceasefire on Wednesday to provide for the functioning of humanitarian corridors from Kyiv, Chernihiv, Sumy, Kharkiv, and Mariupol, the Russian interagency humanitarian response coordination staff in Ukraine said in a statement. ;;;; KYIV. March 9 (Interfax-Ukraine) - The availability of the Sumy-Poltava humanitarian corridor was extended on Wednesday, head of the Sumy regional state administration Dmytro Zhivitsky said. ""The team of negotiators was working through the night, and the availability of a humanitarian passage from Sumy to Poltava was extended today, on March 9, 2022, from 9 a.m. to 9 p.m.,"" Zhivitsky said on Telegram on Wednesday. ""You can use your own vehicles. Besides, at about 2 p.m., we will bring back 22 buses from Poltava to Sumy; the buses formed the first convoy yesterday. They will be available to pregnant women, women with children, senior citizens, and people with disabilities,"" he said. ;;;; Russia offers Wednesday cease-fire for humanitarian corridors
 The Russian military said it would offer a cease-fire starting at 10 a.m. local time (0700 UTC) Wednesday to allow civilians to escape from four Ukrainian cities, according to Russia's TASS news agency. 
 A senior military official told TASS that information about humanitarian corridors from Kyiv, Chernihiv, Sumy, Kharkiv and Mariupol would be sent to Ukrainian Deputy Prime Minister Iryna Vereshchuk.
 Ukraine has yet to respond to the offer. 
 Similar attempts to enable safe evacuation of civilians have been only partially successful, with allegations of shelling on some routes, disputes over the routes themselves, and other complications.  see source: https://interfax.com/newsroom/top-stories/75969/?sphrase_id=79069 ;;;; https://interfax.com/newsroom/top-stories/75987/?sphrase_id=79069 ;;; https://www.dw.com/en/ukraine-civilian-evacuation-efforts-hampered-by-continued-fighting-as-it-happened/a-61046457",https://interfax.com/newsroom/top-stories/75969/?sphrase_id=79069 ;;;; https://interfax.com/newsroom/top-stories/75987/?sphrase_id=79069 ;;; https://www.dw.com/en/ukraine-civilian-evacuation-efforts-hampered-by-continued-fighting-as-it-happened/a-61046457,src-175,proposed route/outcome unknown,Sumy,Sumy,50.9216,34.80029,UA.21,21,Sumy,UA,Poltava,Poltava,49.62417,38.12374,UA.14,14,Luhansk,UA
17,09.03.22,2022-03-09,3,9,2022,Russia,proposed route/outcome unknown,"Status: proposed route/outcome unknown; MOSCOW. March 8 (Interfax) - Russia will declare a temporary ceasefire on Wednesday to provide for the functioning of humanitarian corridors from Kyiv, Chernihiv, Sumy, Kharkiv, and Mariupol, the Russian interagency humanitarian response coordination staff in Ukraine said in a statement. ;;;; KYIV. March 9 (Interfax-Ukraine) - The availability of the Sumy-Poltava humanitarian corridor was extended on Wednesday, head of the Sumy regional state administration Dmytro Zhivitsky said. ""The team of negotiators was working through the night, and the availability of a humanitarian passage from Sumy to Poltava was extended today, on March 9, 2022, from 9 a.m. to 9 p.m.,"" Zhivitsky said on Telegram on Wednesday. ""You can use your own vehicles. Besides, at about 2 p.m., we will bring back 22 buses from Poltava to Sumy; the buses formed the first convoy yesterday. They will be available to pregnant women, women with children, senior citizens, and people with disabilities,"" he said. ;;;; Russia offers Wednesday cease-fire for humanitarian corridors
 The Russian military said it would offer a cease-fire starting at 10 a.m. local time (0700 UTC) Wednesday to allow civilians to escape from four Ukrainian cities, according to Russia's TASS news agency. 
 A senior military official told TASS that information about humanitarian corridors from Kyiv, Chernihiv, Sumy, Kharkiv and Mariupol would be sent to Ukrainian Deputy Prime Minister Iryna Vereshchuk.
 Ukraine has yet to respond to the offer. 
 Similar attempts to enable safe evacuation of civilians have been only partially successful, with allegations of shelling on some routes, disputes over the routes themselves, and other complications.  see source: https://interfax.com/newsroom/top-stories/75969/?sphrase_id=79069",https://interfax.com/newsroom/top-stories/75969/?sphrase_id=79069,src-10,proposed route/outcome unknown,Kharkiv,Kharkiv,49.98081,36.25272,UA.07,7,Kharkiv,UA,Lviv,Lviv,47.8922,31.09156,UA.16,16,Mykolayiv Oblast,UA
18,09.03.22,2022-03-09,3,9,2022,Russia,proposed route/outcome unknown,"Status: proposed route/outcome unknown; MOSCOW. March 8 (Interfax) - Russia will declare a temporary ceasefire on Wednesday to provide for the functioning of humanitarian corridors from Kyiv, Chernihiv, Sumy, Kharkiv, and Mariupol, the Russian interagency humanitarian response coordination staff in Ukraine said in a statement. ;;;; KYIV. March 9 (Interfax-Ukraine) - The availability of the Sumy-Poltava humanitarian corridor was extended on Wednesday, head of the Sumy regional state administration Dmytro Zhivitsky said. ""The team of negotiators was working through the night, and the availability of a humanitarian passage from Sumy to Poltava was extended today, on March 9, 2022, from 9 a.m. to 9 p.m.,"" Zhivitsky said on Telegram on Wednesday. ""You can use your own vehicles. Besides, at about 2 p.m., we will bring back 22 buses from Poltava to Sumy; the buses formed the first convoy yesterday. They will be available to pregnant women, women with children, senior citizens, and people with disabilities,"" he said. ;;;; Russia offers Wednesday cease-fire for humanitarian corridors
 The Russian military said it would offer a cease-fire starting at 10 a.m. local time (0700 UTC) Wednesday to allow civilians to escape from four Ukrainian cities, according to Russia's TASS news agency. 
 A senior military official told TASS that information about humanitarian corridors from Kyiv, Chernihiv, Sumy, Kharkiv and Mariupol would be sent to Ukrainian Deputy Prime Minister Iryna Vereshchuk.
 Ukraine has yet to respond to the offer. 
 Similar attempts to enable safe evacuation of civilians have been only partially successful, with allegations of shelling on some routes, disputes over the routes themselves, and other complications.  see source: https://interfax.com/newsroom/top-stories/75969/?sphrase_id=79069",https://interfax.com/newsroom/top-stories/75969/?sphrase_id=79069,src-10,proposed route/outcome unknown,Kharkiv,Kharkiv,49.98081,36.25272,UA.07,7,Kharkiv,UA,Uzhhorod,,48.62389,22.295,UA.25,25,Transcarpathia,UA
19,09.03.22,2022-03-09,3,9,2022,Russia,proposed route/outcome unknown,"Status: proposed route/outcome unknown; MOSCOW. March 8 (Interfax) - Russia will declare a temporary ceasefire on Wednesday to provide for the functioning of humanitarian corridors from Kyiv, Chernihiv, Sumy, Kharkiv, and Mariupol, the Russian interagency humanitarian response coordination staff in Ukraine said in a statement. ;;;; KYIV. March 9 (Interfax-Ukraine) - The availability of the Sumy-Poltava humanitarian corridor was extended on Wednesday, head of the Sumy regional state administration Dmytro Zhivitsky said. ""The team of negotiators was working through the night, and the availability of a humanitarian passage from Sumy to Poltava was extended today, on March 9, 2022, from 9 a.m. to 9 p.m.,"" Zhivitsky said on Telegram on Wednesday. ""You can use your own vehicles. Besides, at about 2 p.m., we will bring back 22 buses from Poltava to Sumy; the buses formed the first convoy yesterday. They will be available to pregnant women, women with children, senior citizens, and people with disabilities,"" he said. ;;;; Russia offers Wednesday cease-fire for humanitarian corridors
 The Russian military said it would offer a cease-fire starting at 10 a.m. local time (0700 UTC) Wednesday to allow civilians to escape from four Ukrainian cities, according to Russia's TASS news agency. 
 A senior military official told TASS that information about humanitarian corridors from Kyiv, Chernihiv, Sumy, Kharkiv and Mariupol would be sent to Ukrainian Deputy Prime Minister Iryna Vereshchuk.
 Ukraine has yet to respond to the offer. 
 Similar attempts to enable safe evacuation of civilians have been only partially successful, with allegations of shelling on some routes, disputes over the routes themselves, and other complications.  see source: https://interfax.com/newsroom/top-stories/75969/?sphrase_id=79069",https://interfax.com/newsroom/top-stories/75969/?sphrase_id=79069,src-10,proposed route/outcome unknown,Kharkiv,Kharkiv,49.98081,36.25272,UA.07,7,Kharkiv,UA,Ivano-Frankivsk,Ivano-Frankivsk,48.92312,24.71248,UA.06,6,Ivano-Frankivsk Oblast,UA
20,09.03.22,2022-03-09,3,9,2022,Russia,proposed route/outcome unknown,"Status: proposed route/outcome unknown; MOSCOW. March 8 (Interfax) - Russia will declare a temporary ceasefire on Wednesday to provide for the functioning of humanitarian corridors from Kyiv, Chernihiv, Sumy, Kharkiv, and Mariupol, the Russian interagency humanitarian response coordination staff in Ukraine said in a statement. ;;;; KYIV. March 9 (Interfax-Ukraine) - The availability of the Sumy-Poltava humanitarian corridor was extended on Wednesday, head of the Sumy regional state administration Dmytro Zhivitsky said. ""The team of negotiators was working through the night, and the availability of a humanitarian passage from Sumy to Poltava was extended today, on March 9, 2022, from 9 a.m. to 9 p.m.,"" Zhivitsky said on Telegram on Wednesday. ""You can use your own vehicles. Besides, at about 2 p.m., we will bring back 22 buses from Poltava to Sumy; the buses formed the first convoy yesterday. They will be available to pregnant women, women with children, senior citizens, and people with disabilities,"" he said. ;;;; Russia offers Wednesday cease-fire for humanitarian corridors
 The Russian military said it would offer a cease-fire starting at 10 a.m. local time (0700 UTC) Wednesday to allow civilians to escape from four Ukrainian cities, according to Russia's TASS news agency. 
 A senior military official told TASS that information about humanitarian corridors from Kyiv, Chernihiv, Sumy, Kharkiv and Mariupol would be sent to Ukrainian Deputy Prime Minister Iryna Vereshchuk.
 Ukraine has yet to respond to the offer. 
 Similar attempts to enable safe evacuation of civilians have been only partially successful, with allegations of shelling on some routes, disputes over the routes themselves, and other complications.  see source: https://interfax.com/newsroom/top-stories/75969/?sphrase_id=79069",https://interfax.com/newsroom/top-stories/75969/?sphrase_id=79069,src-10,proposed route/outcome unknown,Mariupol,Mariupol,47.09514,37.54131,UA.05,5,Donetsk Oblast,UA,Zaporizhzhya,Zaporizhzhya,47.85167,35.11714,UA.26,26,Zaporizhzhya Oblast,UA
22,09.03.22,2022-03-09,3,9,2022,Russia,proposed route/outcome unknown,"Status: proposed route/outcome unknown; MOSCOW. March 8 (Interfax) - Russia will declare a temporary ceasefire on Wednesday to provide for the functioning of humanitarian corridors from Kyiv, Chernihiv, Sumy, Kharkiv, and Mariupol, the Russian interagency humanitarian response coordination staff in Ukraine said in a statement. ;;;; KYIV. March 9 (Interfax-Ukraine) - The availability of the Sumy-Poltava humanitarian corridor was extended on Wednesday, head of the Sumy regional state administration Dmytro Zhivitsky said. ""The team of negotiators was working through the night, and the availability of a humanitarian passage from Sumy to Poltava was extended today, on March 9, 2022, from 9 a.m. to 9 p.m.,"" Zhivitsky said on Telegram on Wednesday. ""You can use your own vehicles. Besides, at about 2 p.m., we will bring back 22 buses from Poltava to Sumy; the buses formed the first convoy yesterday. They will be available to pregnant women, women with children, senior citizens, and people with disabilities,"" he said. ;;;; Russia offers Wednesday cease-fire for humanitarian corridors
 The Russian military said it would offer a cease-fire starting at 10 a.m. local time (0700 UTC) Wednesday to allow civilians to escape from four Ukrainian cities, according to Russia's TASS news agency. 
 A senior military official told TASS that information about humanitarian corridors from Kyiv, Chernihiv, Sumy, Kharkiv and Mariupol would be sent to Ukrainian Deputy Prime Minister Iryna Vereshchuk.
 Ukraine has yet to respond to the offer. 
 Similar attempts to enable safe evacuation of civilians have been only partially successful, with allegations of shelling on some routes, disputes over the routes themselves, and other complications.  see source: https://interfax.com/newsroom/top-stories/75969/?sphrase_id=79069",https://interfax.com/newsroom/top-stories/75969/?sphrase_id=79069,src-10,proposed route/outcome unknown,Kyiv,Kyiv,50.45466,30.5238,UA.12,12,Kyiv City,UA,Gomel (Belaurs) and then by air to the Russian Federation,,52.43652,30.96949,,,,BY
23,09.03.22,2022-03-09,3,9,2022,Ukraine,successful,"Status: successful; KYIV. March 9 (Interfax-Ukraine) - Dmytro Orlov, mayor of Enerhodar in the Zaporizhzhya region, has reported a ceasefire established at 9 a.m. local time (10:00 a.m. Moscow time) on Wednesday and the opening under the aegis of the International Committee of the Red Cross (ICRC) of a humanitarian corridor from Zaporizhzhya to Enerhodar and a green passage to Zaporizhzhya for evacuating civilians. ;;;; ZAPORIZHZHYA. March 9 (Interfax-Ukraine) - Buses with evacuees from Enerhodar (Zaporizhzhya region, Ukraine), which is now controlled by Russian troops, have arrived in Zaporizhzhya. The evacuation was carried out through a ""green corridor"" between the two cities and this evening the column of evacuation buses ""reached the point of destination,"" Enerhodar mayor Dmytro Orlov said on Telegram. There were also other ""citizens in personal vehicles"" who exited via the corridor and were now arriving in the suburbs of Zaporizhzhya, he said. According to the Zaporizhzhya city council, child evacuees were placed at kindergartens and given food. After that, they will be examined by medics. Earlier the Russian Defense Ministry said that on February 28, its troops ""took control over Enerhodar, Zaporizhzhya nuclear power plant and the adjacent area."" On March 9 the ministry said a ""humanitarian corridor"" was opened from Enerhodar to Zaporizhzhya.  see source: https://interfax.com/newsroom/top-stories/76011/?sphrase_id=79069 ;;;; https://interfax.com/newsroom/top-stories/76131/?sphrase_id=79069",https://interfax.com/newsroom/top-stories/76011/?sphrase_id=79069 ;;;; https://interfax.com/newsroom/top-stories/76131/?sphrase_id=79069,src-176,successful,Zaporizhzhya,Zaporizhzhya,47.85167,35.11714,UA.26,26,Zaporizhzhya Oblast,UA,Enerhodar,Enerhodar,47.49048,34.66199,UA.26,26,Zaporizhzhya Oblast,UA
24,09.03.22,2022-03-09,3,9,2022,Ukraine,successful,"Status: successful; KYIV. March 9 (Interfax-Ukraine) - Evacuation buses have departed Enerhodar to carry residents of the city to Zaporizhzhya, Kyrylo Tymoshenko, deputy head of the Ukrainian presidential office, said in a video on his Telegram account. A column of vehicles is also being formed in the Poltava region to evacuate people from Sumy with support from the Ukrainian Red Cross, he said. It was reported earlier that, starting from 9:00 a.m. local time (10:00 a.m. Moscow Time) until 9:00 p.m., a temporary ceasefire would be declared to facilitate the functioning of humanitarian corridors linking Enerhodar with Zaporizhzhya, Sumy with Poltava, Izyum with Lozova, Mariupol with Zaporizhzhya, Volnovakha with Pokrovsk, and Vorzel, Borodyanka, Irpin, and Hostomel with Kyiv.  see source: https://interfax.com/newsroom/top-stories/76072/?sphrase_id=79069",https://interfax.com/newsroom/top-stories/76072/?sphrase_id=79069,src-3,successful,Sumy,Sumy,50.9216,34.80029,UA.21,21,Sumy,UA,Poltava,Poltava,49.62417,38.12374,UA.14,14,Luhansk,UA
25,09.03.22,2022-03-09,3,9,2022,Ukraine,successful,"Status: successful; KYIV. March 9 (Interfax-Ukraine) - Evacuation buses have departed Enerhodar to carry residents of the city to Zaporizhzhya, Kyrylo Tymoshenko, deputy head of the Ukrainian presidential office, said in a video on his Telegram account. A column of vehicles is also being formed in the Poltava region to evacuate people from Sumy with support from the Ukrainian Red Cross, he said. It was reported earlier that, starting from 9:00 a.m. local time (10:00 a.m. Moscow Time) until 9:00 p.m., a temporary ceasefire would be declared to facilitate the functioning of humanitarian corridors linking Enerhodar with Zaporizhzhya, Sumy with Poltava, Izyum with Lozova, Mariupol with Zaporizhzhya, Volnovakha with Pokrovsk, and Vorzel, Borodyanka, Irpin, and Hostomel with Kyiv.  see source: https://interfax.com/newsroom/top-stories/76072/?sphrase_id=79069",https://interfax.com/newsroom/top-stories/76072/?sphrase_id=79069,src-3,successful,Izyum,,49.20697,37.27679,UA.07,7,Kharkiv,UA,Lozova,Lozova,51.59565,32.52693,UA.02,2,Chernihiv,UA
26,09.03.22,2022-03-09,3,9,2022,Ukraine,successful,"Status: successful; KYIV. March 9 (Interfax-Ukraine) - Evacuation buses have departed Enerhodar to carry residents of the city to Zaporizhzhya, Kyrylo Tymoshenko, deputy head of the Ukrainian presidential office, said in a video on his Telegram account. A column of vehicles is also being formed in the Poltava region to evacuate people from Sumy with support from the Ukrainian Red Cross, he said. It was reported earlier that, starting from 9:00 a.m. local time (10:00 a.m. Moscow Time) until 9:00 p.m., a temporary ceasefire would be declared to facilitate the functioning of humanitarian corridors linking Enerhodar with Zaporizhzhya, Sumy with Poltava, Izyum with Lozova, Mariupol with Zaporizhzhya, Volnovakha with Pokrovsk, and Vorzel, Borodyanka, Irpin, and Hostomel with Kyiv.  see source: https://interfax.com/newsroom/top-stories/76072/?sphrase_id=79069",https://interfax.com/newsroom/top-stories/76072/?sphrase_id=79069,src-3,successful,Mariupol,Mariupol,47.09514,37.54131,UA.05,5,Donetsk Oblast,UA,Zaporizhzhya,Zaporizhzhya,47.85167,35.11714,UA.26,26,Zaporizhzhya Oblast,UA
27,09.03.22,2022-03-09,3,9,2022,Ukraine,successful,"Status: successful; KYIV. March 9 (Interfax-Ukraine) - Evacuation buses have departed Enerhodar to carry residents of the city to Zaporizhzhya, Kyrylo Tymoshenko, deputy head of the Ukrainian presidential office, said in a video on his Telegram account. A column of vehicles is also being formed in the Poltava region to evacuate people from Sumy with support from the Ukrainian Red Cross, he said. It was reported earlier that, starting from 9:00 a.m. local time (10:00 a.m. Moscow Time) until 9:00 p.m., a temporary ceasefire would be declared to facilitate the functioning of humanitarian corridors linking Enerhodar with Zaporizhzhya, Sumy with Poltava, Izyum with Lozova, Mariupol with Zaporizhzhya, Volnovakha with Pokrovsk, and Vorzel, Borodyanka, Irpin, and Hostomel with Kyiv.  see source: https://interfax.com/newsroom/top-stories/76072/?sphrase_id=79069",https://interfax.com/newsroom/top-stories/76072/?sphrase_id=79069,src-3,successful,Volnovakha,Volnovakha,47.60103,37.49674,UA.05,5,Donetsk Oblast,UA,Pokrovsk,Pokrovsk,48.28198,37.17585,UA.05,5,Donetsk Oblast,UA
28,09.03.22,2022-03-09,3,9,2022,Ukraine,successful,"Status: successful; KYIV. March 9 (Interfax-Ukraine) - Evacuation buses have departed Enerhodar to carry residents of the city to Zaporizhzhya, Kyrylo Tymoshenko, deputy head of the Ukrainian presidential office, said in a video on his Telegram account. A column of vehicles is also being formed in the Poltava region to evacuate people from Sumy with support from the Ukrainian Red Cross, he said. It was reported earlier that, starting from 9:00 a.m. local time (10:00 a.m. Moscow Time) until 9:00 p.m., a temporary ceasefire would be declared to facilitate the functioning of humanitarian corridors linking Enerhodar with Zaporizhzhya, Sumy with Poltava, Izyum with Lozova, Mariupol with Zaporizhzhya, Volnovakha with Pokrovsk, and Vorzel, Borodyanka, Irpin, and Hostomel with Kyiv.  see source: https://interfax.com/newsroom/top-stories/76072/?sphrase_id=79069",https://interfax.com/newsroom/top-stories/76072/?sphrase_id=79069,src-3,successful,Vorzel,Vorzel,50.5444,30.15305,UA.13,13,Kiev,UA,Kyiv,Kyiv,50.45466,30.5238,UA.12,12,Kyiv City,UA
29,09.03.22,2022-03-09,3,9,2022,Ukraine,successful,"Status: successful; KYIV. March 9 (Interfax-Ukraine) - Evacuation buses have departed Enerhodar to carry residents of the city to Zaporizhzhya, Kyrylo Tymoshenko, deputy head of the Ukrainian presidential office, said in a video on his Telegram account. A column of vehicles is also being formed in the Poltava region to evacuate people from Sumy with support from the Ukrainian Red Cross, he said. It was reported earlier that, starting from 9:00 a.m. local time (10:00 a.m. Moscow Time) until 9:00 p.m., a temporary ceasefire would be declared to facilitate the functioning of humanitarian corridors linking Enerhodar with Zaporizhzhya, Sumy with Poltava, Izyum with Lozova, Mariupol with Zaporizhzhya, Volnovakha with Pokrovsk, and Vorzel, Borodyanka, Irpin, and Hostomel with Kyiv.  see source: https://interfax.com/newsroom/top-stories/76072/?sphrase_id=79069",https://interfax.com/newsroom/top-stories/76072/?sphrase_id=79069,src-3,successful,Borodyanka,,50.64225,29.91404,UA.13,13,Kiev,UA,Kyiv,Kyiv,50.45466,30.5238,UA.12,12,Kyiv City,UA
30,09.03.22,2022-03-09,3,9,2022,Ukraine,successful,"Status: successful; KYIV. March 9 (Interfax-Ukraine) - Evacuation buses have departed Enerhodar to carry residents of the city to Zaporizhzhya, Kyrylo Tymoshenko, deputy head of the Ukrainian presidential office, said in a video on his Telegram account. A column of vehicles is also being formed in the Poltava region to evacuate people from Sumy with support from the Ukrainian Red Cross, he said. It was reported earlier that, starting from 9:00 a.m. local time (10:00 a.m. Moscow Time) until 9:00 p.m., a temporary ceasefire would be declared to facilitate the functioning of humanitarian corridors linking Enerhodar with Zaporizhzhya, Sumy with Poltava, Izyum with Lozova, Mariupol with Zaporizhzhya, Volnovakha with Pokrovsk, and Vorzel, Borodyanka, Irpin, and Hostomel with Kyiv.  see source: https://interfax.com/newsroom/top-stories/76072/?sphrase_id=79069",https://interfax.com/newsroom/top-stories/76072/?sphrase_id=79069,src-3,successful,Irpin,Irpin,50.52175,30.25055,UA.13,13,Kiev,UA,Kyiv,Kyiv,50.45466,30.5238,UA.12,12,Kyiv City,UA
31,09.03.22,2022-03-09,3,9,2022,Ukraine,successful,"Status: successful; KYIV. March 9 (Interfax-Ukraine) - Evacuation buses have departed Enerhodar to carry residents of the city to Zaporizhzhya, Kyrylo Tymoshenko, deputy head of the Ukrainian presidential office, said in a video on his Telegram account. A column of vehicles is also being formed in the Poltava region to evacuate people from Sumy with support from the Ukrainian Red Cross, he said. It was reported earlier that, starting from 9:00 a.m. local time (10:00 a.m. Moscow Time) until 9:00 p.m., a temporary ceasefire would be declared to facilitate the functioning of humanitarian corridors linking Enerhodar with Zaporizhzhya, Sumy with Poltava, Izyum with Lozova, Mariupol with Zaporizhzhya, Volnovakha with Pokrovsk, and Vorzel, Borodyanka, Irpin, and Hostomel with Kyiv.  see source: https://interfax.com/newsroom/top-stories/76072/?sphrase_id=79069",https://interfax.com/newsroom/top-stories/76072/?sphrase_id=79069,src-3,successful,Hostomel,Hostomel,50.56841,30.2651,UA.13,13,Kiev,UA,Kyiv,Kyiv,50.45466,30.5238,UA.12,12,Kyiv City,UA
33,09.03.22,2022-03-09,3,9,2022,Agreed,proposed route/outcome unknown,"Status: proposed route/outcome unknown; Russia submitted an initiative to the Ukrainian authorities to open ten humanitarian corridors on March 9 to evacuate civilians and foreign citizens from Kyiv, Chernihiv, Sumy, Kharkiv, and Mariupol, including a humanitarian corridor from each of these cities leading to Russia and one corridor from each of these cities transiting Kyiv-controlled territories to Poland, Moldova and Romania, he said.
 ""Only three routes were agreed: one from Kyiv to the south, one from Sumy to Poltava and one from Mariupol to Zaporizhzhya. But another three were proposed: from Enerhodar to Zaporizhzhya, from Volnovakha to Pokrovsk, and from Izyum to Lozova,"" Mizintsev said.  see source: https://interfax.com/newsroom/top-stories/76105/?sphrase_id=79069",https://interfax.com/newsroom/top-stories/76105/?sphrase_id=79069,src-23,proposed route/outcome unknown,Sumy,Sumy,50.9216,34.80029,UA.21,21,Sumy,UA,Poltava,Poltava,49.62417,38.12374,UA.14,14,Luhansk,UA
34,09.03.22,2022-03-09,3,9,2022,Agreed,proposed route/outcome unknown,"Status: proposed route/outcome unknown; Russia submitted an initiative to the Ukrainian authorities to open ten humanitarian corridors on March 9 to evacuate civilians and foreign citizens from Kyiv, Chernihiv, Sumy, Kharkiv, and Mariupol, including a humanitarian corridor from each of these cities leading to Russia and one corridor from each of these cities transiting Kyiv-controlled territories to Poland, Moldova and Romania, he said.
 ""Only three routes were agreed: one from Kyiv to the south, one from Sumy to Poltava and one from Mariupol to Zaporizhzhya. But another three were proposed: from Enerhodar to Zaporizhzhya, from Volnovakha to Pokrovsk, and from Izyum to Lozova,"" Mizintsev said.  see source: https://interfax.com/newsroom/top-stories/76105/?sphrase_id=79069",https://interfax.com/newsroom/top-stories/76105/?sphrase_id=79069,src-23,proposed route/outcome unknown,Mariupol,Mariupol,47.09514,37.54131,UA.05,5,Donetsk Oblast,UA,Zaporizhzhya,Zaporizhzhya,47.85167,35.11714,UA.26,26,Zaporizhzhya Oblast,UA
42,11.03.22,2022-03-11,3,11,2022,Ukraine,proposed route/outcome unknown,"Status: unknown; ""We are opening additional humanitarian passages on the following routes: from Mariupol in the Donetsk region to Zaporizhzhya... with the mandatory demining of the entire route. A humanitarian convoy and buses will leave Zaporizhzhya for Mariupol. We are hoping and expecting the route to open today,"" Vereshchuk said at a press briefing on Friday.  see source: https://interfax.com/newsroom/top-stories/76371/?sphrase_id=78655",https://interfax.com/newsroom/top-stories/76371/?sphrase_id=78655,src-177,unknown,Mariupol,Mariupol,47.09514,37.54131,UA.05,5,Donetsk Oblast,UA,Zaporizhzhya,Zaporizhzhya,47.85167,35.11714,UA.26,26,Zaporizhzhya Oblast,UA
43,11.03.22,2022-03-11,3,11,2022,Ukraine,proposed route/outcome unknown,"Status: proposed route/outcome unknown; ""The Kyiv authorities have additionally requested another four routes from the cities of Izyum, Enerhodar, Volnovakha, and on the Zhytomyr track,"" he said.  see source: https://interfax.com/newsroom/top-stories/76371/?sphrase_id=78655; https://interfax.com/newsroom/top-stories/76479/?sphrase_id=78655",https://interfax.com/newsroom/top-stories/76371/?sphrase_id=78655; https://interfax.com/newsroom/top-stories/76479/?sphrase_id=78655,src-178,proposed route/outcome unknown,Volnovakha,Volnovakha,47.60103,37.49674,UA.05,5,Donetsk Oblast,UA,Pokrovsk,Pokrovsk,48.28198,37.17585,UA.05,5,Donetsk Oblast,UA
44,11.03.22,2022-03-11,3,11,2022,Ukraine,proposed route/outcome unknown,Status: proposed route/outcome unknown;   see source: https://interfax.com/newsroom/top-stories/76371/?sphrase_id=78655,https://interfax.com/newsroom/top-stories/76371/?sphrase_id=78655,src-14,proposed route/outcome unknown,Polohi,,47.47865,36.25463,UA.26,26,Zaporizhzhya Oblast,UA,Zaporizhzhya,Zaporizhzhya,47.85167,35.11714,UA.26,26,Zaporizhzhya Oblast,UA
45,11.03.22,2022-03-11,3,11,2022,Ukraine,successful,"Status: successful; ""The Kyiv authorities have additionally requested another four routes from the cities of Izyum, Enerhodar, Volnovakha, and on the Zhytomyr track,"" he said.; ""We managed to rescue 7,144 people from Enerhodar, Bucha, Hostomel and Kozarovichi... We'll do it. We will do everything to get humanitarian cargo into Ukrainian cities,"" Zelensky said.  see source: https://interfax.com/newsroom/top-stories/76371/?sphrase_id=78655; https://interfax.com/newsroom/top-stories/76479/?sphrase_id=78655; https://interfax.com/newsroom/top-stories/76568/?sphrase_id=78655",https://interfax.com/newsroom/top-stories/76371/?sphrase_id=78655; https://interfax.com/newsroom/top-stories/76479/?sphrase_id=78655; https://interfax.com/newsroom/top-stories/76568/?sphrase_id=78655,src-179,successful,Enerhodar,Enerhodar,47.49048,34.66199,UA.26,26,Zaporizhzhya Oblast,UA,Zaporizhzhya,Zaporizhzhya,47.85167,35.11714,UA.26,26,Zaporizhzhya Oblast,UA
46,11.03.22,2022-03-11,3,11,2022,Ukraine,unsuccessful/disrupted,"Status: disrupted; MOSCOW. March 11 (Interfax) - The evacuation of the town of Izium to Lozova has been disrupted by Ukrainian authorities, the head of Russia's national defense control center, Mikhail Mizintsev, told a briefing on Friday. ""The Kyiv authorities have additionally requested another four routes from the cities of Izyum, Enerhodar, Volnovakha, and on the Zhytomyr track,"" he said.  see source: https://interfax.com/newsroom/top-stories/76371/?sphrase_id=78655; https://interfax.com/newsroom/top-stories/76466/?sphrase_id=78655; https://interfax.com/newsroom/top-stories/76479/?sphrase_id=78655",https://interfax.com/newsroom/top-stories/76371/?sphrase_id=78655; https://interfax.com/newsroom/top-stories/76466/?sphrase_id=78655; https://interfax.com/newsroom/top-stories/76479/?sphrase_id=78655,src-180,disrupted,Izyum,,49.20697,37.27679,UA.07,7,Kharkiv,UA,Lozove (Kharkiv region),Lozove,47.19443,33.06981,UA.16,16,Mykolayiv Oblast,UA
47,11.03.22,2022-03-11,3,11,2022,Ukraine,successful,"Status: successful; ""We managed to rescue 7,144 people from Enerhodar, Bucha, Hostomel and Kozarovichi... We'll do it. We will do everything to get humanitarian cargo into Ukrainian cities,"" Zelensky said.  see source: https://interfax.com/newsroom/top-stories/76371/?sphrase_id=78655; https://interfax.com/newsroom/top-stories/76568/?sphrase_id=78655",https://interfax.com/newsroom/top-stories/76371/?sphrase_id=78655; https://interfax.com/newsroom/top-stories/76568/?sphrase_id=78655,src-26,successful,Bucha,Bucha,50.58333,30.36667,UA.13,13,Kiev,UA,Kyiv,Kyiv,50.45466,30.5238,UA.12,12,Kyiv City,UA
48,11.03.22,2022-03-11,3,11,2022,Ukraine,successful,"Status: successful; ""We managed to rescue 7,144 people from Enerhodar, Bucha, Hostomel and Kozarovichi... We'll do it. We will do everything to get humanitarian cargo into Ukrainian cities,"" Zelensky said.  see source: https://interfax.com/newsroom/top-stories/76371/?sphrase_id=78655; https://interfax.com/newsroom/top-stories/76568/?sphrase_id=78655",https://interfax.com/newsroom/top-stories/76371/?sphrase_id=78655; https://interfax.com/newsroom/top-stories/76568/?sphrase_id=78655,src-26,successful,Hostomel,Hostomel,50.56841,30.2651,UA.13,13,Kiev,UA,Kyiv,Kyiv,50.45466,30.5238,UA.12,12,Kyiv City,UA
49,11.03.22,2022-03-11,3,11,2022,Ukraine,successful,"Status: successful; ""We managed to rescue 7,144 people from Enerhodar, Bucha, Hostomel and Kozarovichi... We'll do it. We will do everything to get humanitarian cargo into Ukrainian cities,"" Zelensky said.  see source: https://interfax.com/newsroom/top-stories/76371/?sphrase_id=78655; https://interfax.com/newsroom/top-stories/76568/?sphrase_id=78655",https://interfax.com/newsroom/top-stories/76371/?sphrase_id=78655; https://interfax.com/newsroom/top-stories/76568/?sphrase_id=78655,src-26,successful,Kozarovichy,,50.75925,30.36191,UA.13,13,Kiev,UA,Kyiv,Kyiv,50.45466,30.5238,UA.12,12,Kyiv City,UA
50,11.03.22,2022-03-11,3,11,2022,Ukraine,proposed route/outcome unknown,Status: proposed route/outcome unknown;   see source: https://interfax.com/newsroom/top-stories/76371/?sphrase_id=78655,https://interfax.com/newsroom/top-stories/76371/?sphrase_id=78655,src-14,proposed route/outcome unknown,Mykulichy,,48.40431,24.62774,UA.06,6,Ivano-Frankivsk Oblast,UA,Kyiv,Kyiv,50.45466,30.5238,UA.12,12,Kyiv City,UA
51,11.03.22,2022-03-11,3,11,2022,Ukraine,proposed route/outcome unknown,Status: proposed route/outcome unknown;   see source: https://interfax.com/newsroom/top-stories/76371/?sphrase_id=78655,https://interfax.com/newsroom/top-stories/76371/?sphrase_id=78655,src-14,proposed route/outcome unknown,Andriivka (Kyiv region),Andriivka,47.88333,36.18333,UA.04,4,Dnipropetrovsk Oblast,UA,Zhytomyr,Zhytomyr,50.26487,28.67669,UA.27,27,Zhytomyr,UA
52,11.03.22,2022-03-11,3,11,2022,Ukraine,proposed route/outcome unknown,Status: proposed route/outcome unknown;   see source: https://interfax.com/newsroom/top-stories/76371/?sphrase_id=78655,https://interfax.com/newsroom/top-stories/76371/?sphrase_id=78655,src-14,proposed route/outcome unknown,Makarov (Kyiv region),Makarov,48.69917,39.48889,UA.14,14,Luhansk,UA,Zhytomyr,Zhytomyr,50.26487,28.67669,UA.27,27,Zhytomyr,UA
53,11.03.22,2022-03-11,3,11,2022,Ukraine,proposed route/outcome unknown,Status: proposed route/outcome unknown;   see source: https://interfax.com/newsroom/top-stories/76371/?sphrase_id=78655,https://interfax.com/newsroom/top-stories/76371/?sphrase_id=78655,src-14,proposed route/outcome unknown,Borodyanka (Kyiv region),,50.64225,29.91404,UA.13,13,Kiev,UA,Zhytomyr,Zhytomyr,50.26487,28.67669,UA.27,27,Zhytomyr,UA
61,12.03.22,2022-03-12,3,12,2022,Ukraine,proposed route/outcome unknown,"Status: proposed route/outcome unknown; ""A column with humanitarian cargo and buses for evacuation of the people on the way back is today departing the city of Zaporizhzhya for the city of Mariupol, Donetsk region, via the settlements of Zaporizhzhya, Vasilevka, Melitopol, Berdiansk, Mangush and Mariupol,"" Vereshchuk told a briefing on Saturday.  see source: https://interfax.com/newsroom/top-stories/76569/?sphrase_id=78655",https://interfax.com/newsroom/top-stories/76569/?sphrase_id=78655,src-181,proposed route/outcome unknown,Zaporizhzhya,Zaporizhzhya,47.85167,35.11714,UA.26,26,Zaporizhzhya Oblast,UA,Mariupol,Mariupol,47.09514,37.54131,UA.05,5,Donetsk Oblast,UA
63,13.03.22,2022-03-13,3,13,2022,Ukraine,proposed route/outcome unknown,"Status: proposed route/outcome unknown; She also reported on the planned passage from the city of Polohy in the Zaporizhzhya region toward Zaporizhzhya. ""A convoy with humanitarian aid and empty buses to evacuate people will continue to follow the route to Polohy,"" Denisova said.L33  see source: https://interfax.com/newsroom/top-stories/76601/?sphrase_id=78695",https://interfax.com/newsroom/top-stories/76601/?sphrase_id=78695,src-182,proposed route/outcome unknown,Polohy,Polohy,49.91463,30.10524,UA.13,13,Kiev,UA,Zaporizhzhya,Zaporizhzhya,47.85167,35.11714,UA.26,26,Zaporizhzhya Oblast,UA
64,13.03.22,2022-03-13,3,13,2022,Ukraine,proposed route/outcome unknown,"Status: proposed route/outcome unknown; On Sunday, the green corridors will be provided in the Kyiv region: the settlement of Kozarovychi (training center) - Kyiv, Andriyivka - Zhytomyr, Makarov - Zhytomyr, Borodianka - Zhytomyr, Svetylnia - Brovary, Pobeda - Kyiv, Bolsha Dymerka - Brovary.  see source: https://interfax.com/newsroom/top-stories/76601/?sphrase_id=78695",https://interfax.com/newsroom/top-stories/76601/?sphrase_id=78695,src-6,proposed route/outcome unknown,Kozarovychi (training center),Kozarovychi,50.75602,30.35269,UA.13,13,Kiev,UA,Kyiv,Kyiv,50.45466,30.5238,UA.12,12,Kyiv City,UA
65,13.03.22,2022-03-13,3,13,2022,Ukraine,proposed route/outcome unknown,"Status: proposed route/outcome unknown; On Sunday, the green corridors will be provided in the Kyiv region: the settlement of Kozarovychi (training center) - Kyiv, Andriyivka - Zhytomyr, Makarov - Zhytomyr, Borodianka - Zhytomyr, Svetylnia - Brovary, Pobeda - Kyiv, Bolsha Dymerka - Brovary.  see source: https://interfax.com/newsroom/top-stories/76601/?sphrase_id=78695",https://interfax.com/newsroom/top-stories/76601/?sphrase_id=78695,src-6,proposed route/outcome unknown,Andriyivka,Andriyivka,47.50651,32.50777,UA.16,16,Mykolayiv Oblast,UA,Zhytomyr,Zhytomyr,50.26487,28.67669,UA.27,27,Zhytomyr,UA
66,13.03.22,2022-03-13,3,13,2022,Ukraine,proposed route/outcome unknown,"Status: proposed route/outcome unknown; On Sunday, the green corridors will be provided in the Kyiv region: the settlement of Kozarovychi (training center) - Kyiv, Andriyivka - Zhytomyr, Makarov - Zhytomyr, Borodianka - Zhytomyr, Svetylnia - Brovary, Pobeda - Kyiv, Bolsha Dymerka - Brovary.  see source: https://interfax.com/newsroom/top-stories/76601/?sphrase_id=78695",https://interfax.com/newsroom/top-stories/76601/?sphrase_id=78695,src-6,proposed route/outcome unknown,Makarov,Makarov,48.69917,39.48889,UA.14,14,Luhansk,UA,Zhytomyr,Zhytomyr,50.26487,28.67669,UA.27,27,Zhytomyr,UA
67,13.03.22,2022-03-13,3,13,2022,Ukraine,proposed route/outcome unknown,"Status: proposed route/outcome unknown; On Sunday, the green corridors will be provided in the Kyiv region: the settlement of Kozarovychi (training center) - Kyiv, Andriyivka - Zhytomyr, Makarov - Zhytomyr, Borodianka - Zhytomyr, Svetylnia - Brovary, Pobeda - Kyiv, Bolsha Dymerka - Brovary.  see source: https://interfax.com/newsroom/top-stories/76601/?sphrase_id=78695",https://interfax.com/newsroom/top-stories/76601/?sphrase_id=78695,src-6,proposed route/outcome unknown,Borodianka,Borodianka,50.64484,29.9201,UA.13,13,Kiev,UA,Zhytomyr,Zhytomyr,50.26487,28.67669,UA.27,27,Zhytomyr,UA
68,13.03.22,2022-03-13,3,13,2022,Ukraine,proposed route/outcome unknown,"Status: proposed route/outcome unknown; On Sunday, the green corridors will be provided in the Kyiv region: the settlement of Kozarovychi (training center) - Kyiv, Andriyivka - Zhytomyr, Makarov - Zhytomyr, Borodianka - Zhytomyr, Svetylnia - Brovary, Pobeda - Kyiv, Bolsha Dymerka - Brovary.  see source: https://interfax.com/newsroom/top-stories/76601/?sphrase_id=78695",https://interfax.com/newsroom/top-stories/76601/?sphrase_id=78695,src-6,proposed route/outcome unknown,Svetylnia,,50.5657,31.1488,UA.13,13,Kiev,UA,Brovary,Brovary,50.51809,30.80671,UA.13,13,Kiev,UA
69,13.03.22,2022-03-13,3,13,2022,Ukraine,proposed route/outcome unknown,"Status: proposed route/outcome unknown; On Sunday, the green corridors will be provided in the Kyiv region: the settlement of Kozarovychi (training center) - Kyiv, Andriyivka - Zhytomyr, Makarov - Zhytomyr, Borodianka - Zhytomyr, Svetylnia - Brovary, Pobeda - Kyiv, Bolsha Dymerka - Brovary.  see source: https://interfax.com/newsroom/top-stories/76601/?sphrase_id=78695",https://interfax.com/newsroom/top-stories/76601/?sphrase_id=78695,src-6,proposed route/outcome unknown,Pobeda,Pobeda,47.46667,33.05,UA.08,8,Kherson Oblast,UA,Kyiv,Kyiv,50.45466,30.5238,UA.12,12,Kyiv City,UA
70,13.03.22,2022-03-13,3,13,2022,Ukraine,proposed route/outcome unknown,"Status: proposed route/outcome unknown; On Sunday, the green corridors will be provided in the Kyiv region: the settlement of Kozarovychi (training center) - Kyiv, Andriyivka - Zhytomyr, Makarov - Zhytomyr, Borodianka - Zhytomyr, Svetylnia - Brovary, Pobeda - Kyiv, Bolsha Dymerka - Brovary.  see source: https://interfax.com/newsroom/top-stories/76601/?sphrase_id=78695",https://interfax.com/newsroom/top-stories/76601/?sphrase_id=78695,src-6,proposed route/outcome unknown,Bolsha Dymerka,,51.07016,31.067,,,,UA,Brovary,Brovary,50.51809,30.80671,UA.13,13,Kiev,UA
71,13.03.22,2022-03-13,3,13,2022,Ukraine,proposed route/outcome unknown,"Status: proposed route/outcome unknown; The green corridors in the Luhansk region are planned along the following routes: Kremenna-Liman, Rubizhne-Slaviansk (Donetsk region), Popasna-Slaviansk, Schastya-Slaviansk, the settlement Horske-Slaviansk.  see source: https://interfax.com/newsroom/top-stories/76601/?sphrase_id=78695",https://interfax.com/newsroom/top-stories/76601/?sphrase_id=78695,src-12,proposed route/outcome unknown,Kremenna,,49.0495,38.21893,UA.14,14,Luhansk,UA,Liman,Liman,48.30694,38.72,UA.14,14,Luhansk,UA
72,13.03.22,2022-03-13,3,13,2022,Ukraine,proposed route/outcome unknown,"Status: proposed route/outcome unknown; The green corridors in the Luhansk region are planned along the following routes: Kremenna-Liman, Rubizhne-Slaviansk (Donetsk region), Popasna-Slaviansk, Schastya-Slaviansk, the settlement Horske-Slaviansk.  see source: https://interfax.com/newsroom/top-stories/76601/?sphrase_id=78695",https://interfax.com/newsroom/top-stories/76601/?sphrase_id=78695,src-12,proposed route/outcome unknown,Rubizhne,Rubizhne,50.1653,36.82525,UA.07,7,Kharkiv,UA,Slaviansk,,48.85351,37.60242,UA.05,5,Donetsk Oblast,UA
73,13.03.22,2022-03-13,3,13,2022,Ukraine,proposed route/outcome unknown,"Status: proposed route/outcome unknown; The green corridors in the Luhansk region are planned along the following routes: Kremenna-Liman, Rubizhne-Slaviansk (Donetsk region), Popasna-Slaviansk, Schastya-Slaviansk, the settlement Horske-Slaviansk.  see source: https://interfax.com/newsroom/top-stories/76601/?sphrase_id=78695",https://interfax.com/newsroom/top-stories/76601/?sphrase_id=78695,src-12,proposed route/outcome unknown,Popasna,Popasna,48.63328,38.37804,UA.14,14,Luhansk,UA,Slaviansk,,48.85351,37.60242,UA.05,5,Donetsk Oblast,UA
74,13.03.22,2022-03-13,3,13,2022,Ukraine,proposed route/outcome unknown,"Status: proposed route/outcome unknown; The green corridors in the Luhansk region are planned along the following routes: Kremenna-Liman, Rubizhne-Slaviansk (Donetsk region), Popasna-Slaviansk, Schastya-Slaviansk, the settlement Horske-Slaviansk.  see source: https://interfax.com/newsroom/top-stories/76601/?sphrase_id=78695",https://interfax.com/newsroom/top-stories/76601/?sphrase_id=78695,src-12,proposed route/outcome unknown,Schastya,,48.73733,39.23125,UA.14,14,Luhansk,UA,Slaviansk,,48.85351,37.60242,UA.05,5,Donetsk Oblast,UA
75,13.03.22,2022-03-13,3,13,2022,Ukraine,proposed route/outcome unknown,"Status: proposed route/outcome unknown; The green corridors in the Luhansk region are planned along the following routes: Kremenna-Liman, Rubizhne-Slaviansk (Donetsk region), Popasna-Slaviansk, Schastya-Slaviansk, the settlement Horske-Slaviansk.  see source: https://interfax.com/newsroom/top-stories/76601/?sphrase_id=78695",https://interfax.com/newsroom/top-stories/76601/?sphrase_id=78695,src-12,proposed route/outcome unknown,Horske,,48.92,39.02,UA.14,14,Luhansk,UA,Slaviansk,,48.85351,37.60242,UA.05,5,Donetsk Oblast,UA
76,14.03.22,2022-03-14,3,14,2022,Agreed,proposed route/outcome unknown,"Status: proposed route/outcome unknown; KYIV. March 14 (Interfax-Ukraine) - Ten humanitarian corridors in Ukraine have been agreed upon as of March 14, Ukrainian Deputy Prime Minister and Minister for Reintegration of Temporarily Occupied Territories Iryna Vereshchuk said in a video address on Monday. These include humanitarian routes in the Kyiv region (from Bohdanivka, Novobohdanivka, Peremoha, and Bobryk to Brovary, from Hostomel, Nemyshayevo, Vorzel, and Dmytrivka to Bilohorodka) and in the Luhansk region (from Severodonetsk, Popasna, and Hirske to Slovyansk), she said.  see source: https://interfax.com/newsroom/top-stories/76647/?sphrase_id=78695",https://interfax.com/newsroom/top-stories/76647/?sphrase_id=78695,src-0,proposed route/outcome unknown,Bohdanivka,Bohdanivka,49.85,24.43333,UA.15,15,Lviv Oblast,UA,Brovary,Brovary,50.51809,30.80671,UA.13,13,Kiev,UA
77,14.03.22,2022-03-14,3,14,2022,Agreed,proposed route/outcome unknown,"Status: proposed route/outcome unknown; KYIV. March 14 (Interfax-Ukraine) - Ten humanitarian corridors in Ukraine have been agreed upon as of March 14, Ukrainian Deputy Prime Minister and Minister for Reintegration of Temporarily Occupied Territories Iryna Vereshchuk said in a video address on Monday. These include humanitarian routes in the Kyiv region (from Bohdanivka, Novobohdanivka, Peremoha, and Bobryk to Brovary, from Hostomel, Nemyshayevo, Vorzel, and Dmytrivka to Bilohorodka) and in the Luhansk region (from Severodonetsk, Popasna, and Hirske to Slovyansk), she said.  see source: https://interfax.com/newsroom/top-stories/76647/?sphrase_id=78695",https://interfax.com/newsroom/top-stories/76647/?sphrase_id=78695,src-0,proposed route/outcome unknown,Novobohdanivka,Novobohdanivka,46.64567,35.02493,UA.26,26,Zaporizhzhya Oblast,UA,Brovary,Brovary,50.51809,30.80671,UA.13,13,Kiev,UA
78,14.03.22,2022-03-14,3,14,2022,Agreed,proposed route/outcome unknown,"Status: proposed route/outcome unknown; KYIV. March 14 (Interfax-Ukraine) - Ten humanitarian corridors in Ukraine have been agreed upon as of March 14, Ukrainian Deputy Prime Minister and Minister for Reintegration of Temporarily Occupied Territories Iryna Vereshchuk said in a video address on Monday. These include humanitarian routes in the Kyiv region (from Bohdanivka, Novobohdanivka, Peremoha, and Bobryk to Brovary, from Hostomel, Nemyshayevo, Vorzel, and Dmytrivka to Bilohorodka) and in the Luhansk region (from Severodonetsk, Popasna, and Hirske to Slovyansk), she said.  see source: https://interfax.com/newsroom/top-stories/76647/?sphrase_id=78695",https://interfax.com/newsroom/top-stories/76647/?sphrase_id=78695,src-0,proposed route/outcome unknown,Peremoha,Peremoha,47.22425,32.51268,UA.16,16,Mykolayiv Oblast,UA,Brovary,Brovary,50.51809,30.80671,UA.13,13,Kiev,UA
79,14.03.22,2022-03-14,3,14,2022,Agreed,proposed route/outcome unknown,"Status: proposed route/outcome unknown; KYIV. March 14 (Interfax-Ukraine) - Ten humanitarian corridors in Ukraine have been agreed upon as of March 14, Ukrainian Deputy Prime Minister and Minister for Reintegration of Temporarily Occupied Territories Iryna Vereshchuk said in a video address on Monday. These include humanitarian routes in the Kyiv region (from Bohdanivka, Novobohdanivka, Peremoha, and Bobryk to Brovary, from Hostomel, Nemyshayevo, Vorzel, and Dmytrivka to Bilohorodka) and in the Luhansk region (from Severodonetsk, Popasna, and Hirske to Slovyansk), she said.  see source: https://interfax.com/newsroom/top-stories/76647/?sphrase_id=78695",https://interfax.com/newsroom/top-stories/76647/?sphrase_id=78695,src-0,proposed route/outcome unknown,Bobryk,Bobryk,51.13333,31.78333,UA.02,2,Chernihiv,UA,Brovary,Brovary,50.51809,30.80671,UA.13,13,Kiev,UA
80,14.03.22,2022-03-14,3,14,2022,Agreed,proposed route/outcome unknown,"Status: proposed route/outcome unknown; KYIV. March 14 (Interfax-Ukraine) - Ten humanitarian corridors in Ukraine have been agreed upon as of March 14, Ukrainian Deputy Prime Minister and Minister for Reintegration of Temporarily Occupied Territories Iryna Vereshchuk said in a video address on Monday. These include humanitarian routes in the Kyiv region (from Bohdanivka, Novobohdanivka, Peremoha, and Bobryk to Brovary, from Hostomel, Nemyshayevo, Vorzel, and Dmytrivka to Bilohorodka) and in the Luhansk region (from Severodonetsk, Popasna, and Hirske to Slovyansk), she said.  see source: https://interfax.com/newsroom/top-stories/76647/?sphrase_id=78695",https://interfax.com/newsroom/top-stories/76647/?sphrase_id=78695,src-0,proposed route/outcome unknown,Hostomel,Hostomel,50.56841,30.2651,UA.13,13,Kiev,UA,Bilohorodka,Bilohorodka,50.31667,25.55,UA.19,19,Rivne,UA
82,14.03.22,2022-03-14,3,14,2022,Agreed,proposed route/outcome unknown,"Status: proposed route/outcome unknown; KYIV. March 14 (Interfax-Ukraine) - Ten humanitarian corridors in Ukraine have been agreed upon as of March 14, Ukrainian Deputy Prime Minister and Minister for Reintegration of Temporarily Occupied Territories Iryna Vereshchuk said in a video address on Monday. These include humanitarian routes in the Kyiv region (from Bohdanivka, Novobohdanivka, Peremoha, and Bobryk to Brovary, from Hostomel, Nemyshayevo, Vorzel, and Dmytrivka to Bilohorodka) and in the Luhansk region (from Severodonetsk, Popasna, and Hirske to Slovyansk), she said.  see source: https://interfax.com/newsroom/top-stories/76647/?sphrase_id=78695",https://interfax.com/newsroom/top-stories/76647/?sphrase_id=78695,src-0,proposed route/outcome unknown,Vorzel,Vorzel,50.5444,30.15305,UA.13,13,Kiev,UA,Bilohorodka,Bilohorodka,50.31667,25.55,UA.19,19,Rivne,UA
83,14.03.22,2022-03-14,3,14,2022,Agreed,proposed route/outcome unknown,"Status: proposed route/outcome unknown; KYIV. March 14 (Interfax-Ukraine) - Ten humanitarian corridors in Ukraine have been agreed upon as of March 14, Ukrainian Deputy Prime Minister and Minister for Reintegration of Temporarily Occupied Territories Iryna Vereshchuk said in a video address on Monday. These include humanitarian routes in the Kyiv region (from Bohdanivka, Novobohdanivka, Peremoha, and Bobryk to Brovary, from Hostomel, Nemyshayevo, Vorzel, and Dmytrivka to Bilohorodka) and in the Luhansk region (from Severodonetsk, Popasna, and Hirske to Slovyansk), she said.  see source: https://interfax.com/newsroom/top-stories/76647/?sphrase_id=78695",https://interfax.com/newsroom/top-stories/76647/?sphrase_id=78695,src-0,proposed route/outcome unknown,Dmytrivka,Dmytrivka,50.60285,29.78394,UA.13,13,Kiev,UA,Bilohorodka,Bilohorodka,50.31667,25.55,UA.19,19,Rivne,UA
84,14.03.22,2022-03-14,3,14,2022,Agreed,proposed route/outcome unknown,"Status: proposed route/outcome unknown; KYIV. March 14 (Interfax-Ukraine) - Ten humanitarian corridors in Ukraine have been agreed upon as of March 14, Ukrainian Deputy Prime Minister and Minister for Reintegration of Temporarily Occupied Territories Iryna Vereshchuk said in a video address on Monday. These include humanitarian routes in the Kyiv region (from Bohdanivka, Novobohdanivka, Peremoha, and Bobryk to Brovary, from Hostomel, Nemyshayevo, Vorzel, and Dmytrivka to Bilohorodka) and in the Luhansk region (from Severodonetsk, Popasna, and Hirske to Slovyansk), she said.  see source: https://interfax.com/newsroom/top-stories/76647/?sphrase_id=78695",https://interfax.com/newsroom/top-stories/76647/?sphrase_id=78695,src-0,proposed route/outcome unknown,Severodonetsk,,48.94628,38.48624,UA.14,14,Luhansk,UA,Slovyansk,,48.85351,37.60242,UA.05,5,Donetsk Oblast,UA
85,14.03.22,2022-03-14,3,14,2022,Agreed,proposed route/outcome unknown,"Status: proposed route/outcome unknown; KYIV. March 14 (Interfax-Ukraine) - Ten humanitarian corridors in Ukraine have been agreed upon as of March 14, Ukrainian Deputy Prime Minister and Minister for Reintegration of Temporarily Occupied Territories Iryna Vereshchuk said in a video address on Monday. These include humanitarian routes in the Kyiv region (from Bohdanivka, Novobohdanivka, Peremoha, and Bobryk to Brovary, from Hostomel, Nemyshayevo, Vorzel, and Dmytrivka to Bilohorodka) and in the Luhansk region (from Severodonetsk, Popasna, and Hirske to Slovyansk), she said.  see source: https://interfax.com/newsroom/top-stories/76647/?sphrase_id=78695",https://interfax.com/newsroom/top-stories/76647/?sphrase_id=78695,src-0,proposed route/outcome unknown,Popasna,Popasna,48.63328,38.37804,UA.14,14,Luhansk,UA,Slovyansk,,48.85351,37.60242,UA.05,5,Donetsk Oblast,UA
86,14.03.22,2022-03-14,3,14,2022,Agreed,proposed route/outcome unknown,"Status: proposed route/outcome unknown; KYIV. March 14 (Interfax-Ukraine) - Ten humanitarian corridors in Ukraine have been agreed upon as of March 14, Ukrainian Deputy Prime Minister and Minister for Reintegration of Temporarily Occupied Territories Iryna Vereshchuk said in a video address on Monday. These include humanitarian routes in the Kyiv region (from Bohdanivka, Novobohdanivka, Peremoha, and Bobryk to Brovary, from Hostomel, Nemyshayevo, Vorzel, and Dmytrivka to Bilohorodka) and in the Luhansk region (from Severodonetsk, Popasna, and Hirske to Slovyansk), she said.  see source: https://interfax.com/newsroom/top-stories/76647/?sphrase_id=78695",https://interfax.com/newsroom/top-stories/76647/?sphrase_id=78695,src-0,proposed route/outcome unknown,Hirske,Hirske,49.47095,23.79988,UA.15,15,Lviv Oblast,UA,Slovyansk,,48.85351,37.60242,UA.05,5,Donetsk Oblast,UA
87,14.03.22,2022-03-14,3,14,2022,Agreed,successful,"Status: successful; ""Over 160 private cars have managed to depart from Mariupol via the route to the city of Berdiansk by 1 p.m. Mariupol residents were driving along the route of the humanitarian corridor agreed in advance from Mariupol via the exit towards the village of Melekine, [past] the village of Portovske, the village of Manhush, Berdiansk, Tokmak [to] Zaporizhzhya,"" the city council said on its Telegram channel.  see source: https://interfax.com/newsroom/top-stories/76686/?sphrase_id=78695",https://interfax.com/newsroom/top-stories/76686/?sphrase_id=78695,src-183,successful,Mariupol,Mariupol,47.09514,37.54131,UA.05,5,Donetsk Oblast,UA,Zaporizhzhya,Zaporizhzhya,47.85167,35.11714,UA.26,26,Zaporizhzhya Oblast,UA
101,15.03.22,2022-03-15,3,15,2022,Ukraine,successful,"Status: successful; The Sumy region: from the city of Sumy, Trostianets, Lebedyn, Shostka, and Konotop to the city of Poltava. The Kharkiv region: from the village of Oskil,"" she said.  see source: https://interfax.com/newsroom/top-stories/76739/?sphrase_id=78694 ;;; https://interfax.com/newsroom/top-stories/76822/?sphrase_id=81982",https://interfax.com/newsroom/top-stories/76739/?sphrase_id=78694 ;;; https://interfax.com/newsroom/top-stories/76822/?sphrase_id=81982,src-39,successful,Sumy,Sumy,50.9216,34.80029,UA.21,21,Sumy,UA,Poltava,Poltava,49.62417,38.12374,UA.14,14,Luhansk,UA
102,15.03.22,2022-03-15,3,15,2022,Ukraine,successful,"Status: successful; The Sumy region: from the city of Sumy, Trostianets, Lebedyn, Shostka, and Konotop to the city of Poltava. The Kharkiv region: from the village of Oskil,"" she said.  see source: https://interfax.com/newsroom/top-stories/76739/?sphrase_id=78694;;; https://interfax.com/newsroom/top-stories/76822/?sphrase_id=81982",https://interfax.com/newsroom/top-stories/76739/?sphrase_id=78694;;; https://interfax.com/newsroom/top-stories/76822/?sphrase_id=81982,src-184,successful,Trostianets,Trostianets,50.95846,25.56549,UA.24,24,Volyn,UA,Poltava,Poltava,49.62417,38.12374,UA.14,14,Luhansk,UA
103,15.03.22,2022-03-15,3,15,2022,Ukraine,successful,"Status: successful; The Sumy region: from the city of Sumy, Trostianets, Lebedyn, Shostka, and Konotop to the city of Poltava. The Kharkiv region: from the village of Oskil,"" she said.  see source: https://interfax.com/newsroom/top-stories/76739/?sphrase_id=78694 ;;;; https://interfax.com/newsroom/top-stories/76822/?sphrase_id=81982",https://interfax.com/newsroom/top-stories/76739/?sphrase_id=78694 ;;;; https://interfax.com/newsroom/top-stories/76822/?sphrase_id=81982,src-37,successful,Lebedyn,Lebedyn,50.58518,34.4849,UA.21,21,Sumy,UA,Poltava,Poltava,49.62417,38.12374,UA.14,14,Luhansk,UA
104,15.03.22,2022-03-15,3,15,2022,Ukraine,successful,"Status: successful; The Sumy region: from the city of Sumy, Trostianets, Lebedyn, Shostka, and Konotop to the city of Poltava. The Kharkiv region: from the village of Oskil,"" she said.  see source: https://interfax.com/newsroom/top-stories/76739/?sphrase_id=78694 ;;;; https://interfax.com/newsroom/top-stories/76822/?sphrase_id=81982",https://interfax.com/newsroom/top-stories/76739/?sphrase_id=78694 ;;;; https://interfax.com/newsroom/top-stories/76822/?sphrase_id=81982,src-37,successful,Shostka,Shostka,51.86296,33.4698,UA.21,21,Sumy,UA,Poltava,Poltava,49.62417,38.12374,UA.14,14,Luhansk,UA
105,15.03.22,2022-03-15,3,15,2022,Ukraine,successful,"Status: successful; The Sumy region: from the city of Sumy, Trostianets, Lebedyn, Shostka, and Konotop to the city of Poltava. The Kharkiv region: from the village of Oskil,"" she said.  see source: https://interfax.com/newsroom/top-stories/76739/?sphrase_id=78694 ;;; https://interfax.com/newsroom/top-stories/76822/?sphrase_id=81982",https://interfax.com/newsroom/top-stories/76739/?sphrase_id=78694 ;;; https://interfax.com/newsroom/top-stories/76822/?sphrase_id=81982,src-39,successful,Konotop,Konotop,51.7448,31.69919,UA.02,2,Chernihiv,UA,Poltava,Poltava,49.62417,38.12374,UA.14,14,Luhansk,UA
107,15.03.22,2022-03-15,3,15,2022,Agreed,unsuccessful/disrupted,"Status: unsuccessful; ""Nine humanitarian corridors have been agreed for today. The Donetsk region: a humanitarian convoy carrying dozens of tonnes of water, medications and food will depart from the city of Berdyansk ;;; MOSCOW. March 16 (Interfax) - More than 31,000 civilians were evacuated from Ukraine's Mariupol in the past 24 hours, the Russian Defense Ministry said. [Zaporizhzhya region] to the city of Mariupol [Donetsk region]. On its way back, it will collect and transport women, children and all those in need of it from Mariupol to Zaporizhzhya,"" Vereshchuk said in a video address published on the Telegram channel of the Office of the Ukrainian President.::: ""We have no corridors in the Luhansk region today, yet they worked for two days and they worked well. The problem with Mariupol;;; ""A humanitarian operation is underway in Mariupol. As many as 31,367 civilians were safely evacuated from the unblocked city via humanitarian corridors in the past 24 hours,"" head of the Russian National Defense Control Center Mikhail Mizintsev said. persists. Our humanitarian convoy has been unable to reach Mariupol from Berdyansk,"" Vereshchuk said at a press briefing on Tuesday.
 
 The humanitarian trucks have been unable to cover the 84-kilometer distance between Berdyansk and Mariupol for days, she said.
 
 Meanwhile, the Mariupol City Council said earlier on Tuesday that 2,000 vehicles of evacuees left Mariupol for Zaporizhzhya and another 2,000 vehicles were leaving the city as of 2 p.m. local time (3 p.m. Moscow time) on Tuesday.;;;; Out of the overall number of those evacuated on Tuesday, 20,000 people left Mariupol on their own vehicles, Zelensky said.  see source: https://interfax.com/newsroom/top-stories/76739/?sphrase_id=78694 ;;;; https://interfax.com/newsroom/top-stories/76777/?sphrase_id=78694 ;;;; https://interfax.com/newsroom/top-stories/76876/? ;;; https://interfax.com/newsroom/top-stories/76876/?sphrase_id=81982;;;; https://interfax.com/newsroom/top-stories/76822/?sphrase_id=81982",https://interfax.com/newsroom/top-stories/76739/?sphrase_id=78694 ;;;; https://interfax.com/newsroom/top-stories/76777/?sphrase_id=78694 ;;;; https://interfax.com/newsroom/top-stories/76876/? ;;; https://interfax.com/newsroom/top-stories/76876/?sphrase_id=81982;;;; https://interfax.com/newsroom/top-stories/76822/?sphrase_id=81982,src-186,unsuccessful,Berdyansk [Zaporizhzhya region],Berdyansk,46.75578,36.78815,UA.26,26,Zaporizhzhya Oblast,UA,Mariupol,Mariupol,47.09514,37.54131,UA.05,5,Donetsk Oblast,UA
111,17.03.22,2022-03-17,3,17,2022,Agreed,unsuccessful/disrupted,"Status: unsuccessful; KYIV. March 18 (Interfax-Ukraine) - Eight of the nine humanitarian corridors planned for March 17 worked, Ukrainian Deputy Prime Minister and Minister for Reintegration of Temporarily Occupied Territories Iryna Vereshchuk said.
 
 ""Eight of the planned nine humanitarian corridors worked today. [...] The corridor for humanitarian assistance from Kharkiv to Vovchansk did not work. We continue working on coordinating routes for delivering humanitarian assistance,"" Vereshchuk told a briefing on Thursday evening.  see source: https://interfax.com/newsroom/top-stories/76962/?sphrase_id=81982",https://interfax.com/newsroom/top-stories/76962/?sphrase_id=81982,src-187,unsuccessful,Kharkiv,Kharkiv,49.98081,36.25272,UA.07,7,Kharkiv,UA,Vovchansk,Vovchansk,50.29078,36.94108,UA.07,7,Kharkiv,UA
112,17.03.22,2022-03-17,3,17,2022,Ukraine,successful,"Status: successful evacuation of civilians; KYIV. March 18 (Interfax-Ukraine) - A total of 3,810 people were evacuated via humanitarian corridors over the past 24 hours, Office of President of Ukraine deputy head Kyrylo Tymoshenko said.
 
 In particular, 2,000 residents of Mariupol were able to reach Zaporizhzhya. Another 1,810 residents of Vorzel, Bucha, Hostomel, Shevchenkove, and Borodianka are safe.  see source: https://interfax.com/newsroom/top-stories/76961/?sphrase_id=81982",https://interfax.com/newsroom/top-stories/76961/?sphrase_id=81982,src-188,successful evacuation of civilians,Mariupol,Mariupol,47.09514,37.54131,UA.05,5,Donetsk Oblast,UA,Zaporizhzhya,Zaporizhzhya,47.85167,35.11714,UA.26,26,Zaporizhzhya Oblast,UA
119,17.03.22,2022-03-17,3,17,2022,Ukraine,successful,"Status: successful; Thirty-six tonnes of humanitarian assistance in the form of food and medications was also delivered to Hostomel, Bucha, and the villages of Semypolky, Markivtsy, and Apanasov.  see source: https://interfax.com/newsroom/top-stories/76961/?sphrase_id=81982",https://interfax.com/newsroom/top-stories/76961/?sphrase_id=81982,src-192,successful,Shevchenkove,Shevchenkove,46.90661,32.21261,UA.16,16,Mykolayiv Oblast,UA,Brovary,Brovary,50.51809,30.80671,UA.13,13,Kiev,UA
120,17.03.22,2022-03-17,3,17,2022,Ukraine,successful,"Status: successful; Thirty-six tonnes of humanitarian assistance in the form of food and medications was also delivered to Hostomel, Bucha, and the villages of Semypolky, Markivtsy, and Apanasov; Twenty buses carrying some 160 people left Borodianka, Kyiv region, for Zhytomyr.  see source: https://interfax.com/newsroom/top-stories/76961/?sphrase_id=81982 ;;;; https://interfax.com/newsroom/top-stories/76962/?sphrase_id=81982",https://interfax.com/newsroom/top-stories/76961/?sphrase_id=81982 ;;;; https://interfax.com/newsroom/top-stories/76962/?sphrase_id=81982,src-193,successful,Borodianka,Borodianka,50.64484,29.9201,UA.13,13,Kiev,UA,Zhytomyr,Zhytomyr,50.26487,28.67669,UA.27,27,Zhytomyr,UA
127,18.03.22,2022-03-18,3,18,2022,Ukraine,successful,"Status: successful; KYIV. March 19 (Interfax-Ukraine) - Seven out of nine humanitarian corridors operated on Friday, 9,145 people were evacuated, Ukrainian Deputy Prime Minister, Minister for Reintegration of Temporarily Occupied Territories Iryna Vereshchuk said.
 
 A total of 4,972 people were evacuated from Mariupol to Zaporizhzhya, 4,173 people from Sumy region, [including] 3,296 from Sumy, 246 from Trostianets, 50 from Lebedyn, 400 from Konotop, 146 from the Krasnopillia village, 41 from Bolsha Pysarivka. 7 out of 9 functioning; 2 non-functioning not identified ;;; KYIV. March 20 (Interfax-Ukraine) - Eight out of ten humanitarian corridors worked on March 18 to help evacuate 6,623 people, Ukrainian Deputy Prime Minister, Minister for Reintegration of Temporary Occupied Territories Iryna Vereshchuk said in her video address on Saturday. (https://interfax.com/newsroom/top-stories/77067/?sphrase_id=81981) see source: https://interfax.com/newsroom/top-stories/77041/?sphrase_id=81982",https://interfax.com/newsroom/top-stories/77041/?sphrase_id=81982,src-194,successful,Mariupol,Mariupol,47.09514,37.54131,UA.05,5,Donetsk Oblast,UA,Zaporizhzhya,Zaporizhzhya,47.85167,35.11714,UA.26,26,Zaporizhzhya Oblast,UA
128,19.03.22,2022-03-19,3,19,2022,Ukraine,successful,"Status: successful; KYIV. March 19 (Interfax-Ukraine) - Another 471 people came to Zaporizhzhya from Mariupol and Berdyansk on Saturday morning, head of the Kyiv-controlled Zaporizhzhya regional military administration Oleksandr Starukh said. ;;;;; There is a corridor approved in the Donetsk region, and a convoy has left Mariupol for Zaporizhzhya to transport Mariupol residents awaiting evacuation in Berdyansk, she said.
 
 ""The buses will be accompanied by trucks carrying food to the centers assisting Mariupol residents in Berdyansk. All Mariupol residents who come to Mangush, including by foot, are given necessary assistance. Their transportation to Berdyansk by bus will begin today,"" Vereshchuk said. overnight operation, started Friday 18.03.2022, evaucation from Mariupol to Zaporizhzhya via Berdyansk (?) see source: https://interfax.com/newsroom/top-stories/77048/?sphrase_id=81981 ;;; https://interfax.com/newsroom/top-stories/77051/?sphrase_id=81981",https://interfax.com/newsroom/top-stories/77048/?sphrase_id=81981 ;;; https://interfax.com/newsroom/top-stories/77051/?sphrase_id=81981,src-195,successful,Mariupol,Mariupol,47.09514,37.54131,UA.05,5,Donetsk Oblast,UA,Zaporizhzhya,Zaporizhzhya,47.85167,35.11714,UA.26,26,Zaporizhzhya Oblast,UA
129,19.03.22,2022-03-19,3,19,2022,Ukraine,successful,"Status: successful; KYIV. March 19 (Interfax-Ukraine) - Another 471 people came to Zaporizhzhya from Mariupol and Berdyansk on Saturday morning, head of the Kyiv-controlled Zaporizhzhya regional military administration Oleksandr Starukh said. ;;;;; There is a corridor approved in the Donetsk region, and a convoy has left Mariupol for Zaporizhzhya to transport Mariupol residents awaiting evacuation in Berdyansk, she said.
 
 ""The buses will be accompanied by trucks carrying food to the centers assisting Mariupol residents in Berdyansk. All Mariupol residents who come to Mangush, including by foot, are given necessary assistance. Their transportation to Berdyansk by bus will begin today,"" Vereshchuk said. overnight operation, started Friday 18.03.2022, evaucation from Mariupol to Zaporizhzhya via Berdyansk (?) see source: https://interfax.com/newsroom/top-stories/77048/?sphrase_id=81981 ;;;; https://interfax.com/newsroom/top-stories/77051/?sphrase_id=81981",https://interfax.com/newsroom/top-stories/77048/?sphrase_id=81981 ;;;; https://interfax.com/newsroom/top-stories/77051/?sphrase_id=81981,src-196,successful,Berdyansk,Berdyansk,46.75578,36.78815,UA.26,26,Zaporizhzhya Oblast,UA,Zaporizhzhya,Zaporizhzhya,47.85167,35.11714,UA.26,26,Zaporizhzhya Oblast,UA
136,19.03.22,2022-03-19,3,19,2022,Ukraine,proposed route/outcome unknown,"Status: proposed route/outcome unknown; There is also a corridor from Bervytsa to Brovary in the Kyiv region. People are due to reach a bridge in the Mokrets village on their own, cross the Trubizh River and arrive at Sovkhoznaya Street where buses will be waiting for them, she said.
 
 The entire route goes like this: Bervytsa - Mokrets - Zavorychy - Kalyta - Semypolky - Letky - Rozhny - Pukhovka - Zazimye - Brovary.  see source: https://interfax.com/newsroom/top-stories/77051/?sphrase_id=81981",https://interfax.com/newsroom/top-stories/77051/?sphrase_id=81981,src-1,proposed route/outcome unknown,Mokrets,Mokrets,51.02014,24.40307,UA.24,24,Volyn,UA,Brovary,Brovary,50.51809,30.80671,UA.13,13,Kiev,UA
137,19.03.22,2022-03-19,3,19,2022,Ukraine,proposed route/outcome unknown,"Status: proposed route/outcome unknown; There is also a corridor from Bervytsa to Brovary in the Kyiv region. People are due to reach a bridge in the Mokrets village on their own, cross the Trubizh River and arrive at Sovkhoznaya Street where buses will be waiting for them, she said.
 
 The entire route goes like this: Bervytsa - Mokrets - Zavorychy - Kalyta - Semypolky - Letky - Rozhny - Pukhovka - Zazimye - Brovary.  see source: https://interfax.com/newsroom/top-stories/77051/?sphrase_id=81981",https://interfax.com/newsroom/top-stories/77051/?sphrase_id=81981,src-1,proposed route/outcome unknown,Zavorychy,,50.70674,31.13529,UA.13,13,Kiev,UA,Brovary,Brovary,50.51809,30.80671,UA.13,13,Kiev,UA
138,19.03.22,2022-03-19,3,19,2022,Ukraine,proposed route/outcome unknown,"Status: proposed route/outcome unknown; There is also a corridor from Bervytsa to Brovary in the Kyiv region. People are due to reach a bridge in the Mokrets village on their own, cross the Trubizh River and arrive at Sovkhoznaya Street where buses will be waiting for them, she said.
 
 The entire route goes like this: Bervytsa - Mokrets - Zavorychy - Kalyta - Semypolky - Letky - Rozhny - Pukhovka - Zazimye - Brovary.  see source: https://interfax.com/newsroom/top-stories/77051/?sphrase_id=81981",https://interfax.com/newsroom/top-stories/77051/?sphrase_id=81981,src-1,proposed route/outcome unknown,Kalyta,Kalyta,50.75198,31.02351,UA.13,13,Kiev,UA,Brovary,Brovary,50.51809,30.80671,UA.13,13,Kiev,UA
139,19.03.22,2022-03-19,3,19,2022,Ukraine,proposed route/outcome unknown,"Status: proposed route/outcome unknown; There is also a corridor from Bervytsa to Brovary in the Kyiv region. People are due to reach a bridge in the Mokrets village on their own, cross the Trubizh River and arrive at Sovkhoznaya Street where buses will be waiting for them, she said.
 
 The entire route goes like this: Bervytsa - Mokrets - Zavorychy - Kalyta - Semypolky - Letky - Rozhny - Pukhovka - Zazimye - Brovary.  see source: https://interfax.com/newsroom/top-stories/77051/?sphrase_id=81981",https://interfax.com/newsroom/top-stories/77051/?sphrase_id=81981,src-1,proposed route/outcome unknown,Semypolky,Semypolky,50.72627,30.93441,UA.13,13,Kiev,UA,Brovary,Brovary,50.51809,30.80671,UA.13,13,Kiev,UA
141,19.03.22,2022-03-19,3,19,2022,Ukraine,proposed route/outcome unknown,"Status: proposed route/outcome unknown; There is also a corridor from Bervytsa to Brovary in the Kyiv region. People are due to reach a bridge in the Mokrets village on their own, cross the Trubizh River and arrive at Sovkhoznaya Street where buses will be waiting for them, she said.
 
 The entire route goes like this: Bervytsa - Mokrets - Zavorychy - Kalyta - Semypolky - Letky - Rozhny - Pukhovka - Zazimye - Brovary.  see source: https://interfax.com/newsroom/top-stories/77051/?sphrase_id=81981",https://interfax.com/newsroom/top-stories/77051/?sphrase_id=81981,src-1,proposed route/outcome unknown,Rozhny,Rozhny,50.6669,30.73503,UA.13,13,Kiev,UA,Brovary,Brovary,50.51809,30.80671,UA.13,13,Kiev,UA
142,19.03.22,2022-03-19,3,19,2022,Ukraine,proposed route/outcome unknown,"Status: proposed route/outcome unknown; There is also a corridor from Bervytsa to Brovary in the Kyiv region. People are due to reach a bridge in the Mokrets village on their own, cross the Trubizh River and arrive at Sovkhoznaya Street where buses will be waiting for them, she said.
 
 The entire route goes like this: Bervytsa - Mokrets - Zavorychy - Kalyta - Semypolky - Letky - Rozhny - Pukhovka - Zazimye - Brovary.  see source: https://interfax.com/newsroom/top-stories/77051/?sphrase_id=81981",https://interfax.com/newsroom/top-stories/77051/?sphrase_id=81981,src-1,proposed route/outcome unknown,Pukhovka,,50.6097,30.7177,UA.13,13,Kiev,UA,Brovary,Brovary,50.51809,30.80671,UA.13,13,Kiev,UA
143,19.03.22,2022-03-19,3,19,2022,Ukraine,proposed route/outcome unknown,"Status: proposed route/outcome unknown; There is also a corridor from Bervytsa to Brovary in the Kyiv region. People are due to reach a bridge in the Mokrets village on their own, cross the Trubizh River and arrive at Sovkhoznaya Street where buses will be waiting for them, she said.
 
 The entire route goes like this: Bervytsa - Mokrets - Zavorychy - Kalyta - Semypolky - Letky - Rozhny - Pukhovka - Zazimye - Brovary.  see source: https://interfax.com/newsroom/top-stories/77051/?sphrase_id=81981",https://interfax.com/newsroom/top-stories/77051/?sphrase_id=81981,src-1,proposed route/outcome unknown,Zazimye,,50.56923,30.67319,UA.13,13,Kiev,UA,Brovary,Brovary,50.51809,30.80671,UA.13,13,Kiev,UA
144,19.03.22,2022-03-19,3,19,2022,Ukraine,proposed route/outcome unknown,Status: proposed route/outcome unknown; There is also a coordinated route from Bucha to Belohorodka: Bucha - Vorzel - Mykhailivska Rubezhivka - Zabuchye - Dmytrivka - Kapytanivka - Stoyanka - Horenichy - Belohorodka.  see source: https://interfax.com/newsroom/top-stories/77051/?sphrase_id=81981,https://interfax.com/newsroom/top-stories/77051/?sphrase_id=81981,src-2,proposed route/outcome unknown,Bucha,Bucha,50.58333,30.36667,UA.13,13,Kiev,UA,Belohorodka,,50.3897,30.23087,UA.13,13,Kiev,UA
145,19.03.22,2022-03-19,3,19,2022,Ukraine,proposed route/outcome unknown,Status: proposed route/outcome unknown; There is also a coordinated route from Bucha to Belohorodka: Bucha - Vorzel - Mykhailivska Rubezhivka - Zabuchye - Dmytrivka - Kapytanivka - Stoyanka - Horenichy - Belohorodka.  see source: https://interfax.com/newsroom/top-stories/77051/?sphrase_id=81981,https://interfax.com/newsroom/top-stories/77051/?sphrase_id=81981,src-2,proposed route/outcome unknown,Vorzel,Vorzel,50.5444,30.15305,UA.13,13,Kiev,UA,Belohorodka,,50.3897,30.23087,UA.13,13,Kiev,UA
146,19.03.22,2022-03-19,3,19,2022,Ukraine,proposed route/outcome unknown,Status: proposed route/outcome unknown; There is also a coordinated route from Bucha to Belohorodka: Bucha - Vorzel - Mykhailivska Rubezhivka - Zabuchye - Dmytrivka - Kapytanivka - Stoyanka - Horenichy - Belohorodka.  see source: https://interfax.com/newsroom/top-stories/77051/?sphrase_id=81981,https://interfax.com/newsroom/top-stories/77051/?sphrase_id=81981,src-2,proposed route/outcome unknown,Mykhailivska Rubezhivka,,50.50028,30.14583,UA.13,13,Kiev,UA,Belohorodka,,50.3897,30.23087,UA.13,13,Kiev,UA
147,19.03.22,2022-03-19,3,19,2022,Ukraine,proposed route/outcome unknown,Status: proposed route/outcome unknown; There is also a coordinated route from Bucha to Belohorodka: Bucha - Vorzel - Mykhailivska Rubezhivka - Zabuchye - Dmytrivka - Kapytanivka - Stoyanka - Horenichy - Belohorodka.  see source: https://interfax.com/newsroom/top-stories/77051/?sphrase_id=81981,https://interfax.com/newsroom/top-stories/77051/?sphrase_id=81981,src-2,proposed route/outcome unknown,Zabuchye,,50.4961,30.17014,UA.13,13,Kiev,UA,Belohorodka,,50.3897,30.23087,UA.13,13,Kiev,UA
148,19.03.22,2022-03-19,3,19,2022,Ukraine,proposed route/outcome unknown,Status: proposed route/outcome unknown; There is also a coordinated route from Bucha to Belohorodka: Bucha - Vorzel - Mykhailivska Rubezhivka - Zabuchye - Dmytrivka - Kapytanivka - Stoyanka - Horenichy - Belohorodka.  see source: https://interfax.com/newsroom/top-stories/77051/?sphrase_id=81981,https://interfax.com/newsroom/top-stories/77051/?sphrase_id=81981,src-2,proposed route/outcome unknown,Dmytrivka,Dmytrivka,50.60285,29.78394,UA.13,13,Kiev,UA,Belohorodka,,50.3897,30.23087,UA.13,13,Kiev,UA
149,19.03.22,2022-03-19,3,19,2022,Ukraine,proposed route/outcome unknown,Status: proposed route/outcome unknown; There is also a coordinated route from Bucha to Belohorodka: Bucha - Vorzel - Mykhailivska Rubezhivka - Zabuchye - Dmytrivka - Kapytanivka - Stoyanka - Horenichy - Belohorodka.  see source: https://interfax.com/newsroom/top-stories/77051/?sphrase_id=81981,https://interfax.com/newsroom/top-stories/77051/?sphrase_id=81981,src-2,proposed route/outcome unknown,Kapytanivka,,48.91686,31.71599,UA.10,10,Kirovohrad Oblast,UA,Belohorodka,,50.3897,30.23087,UA.13,13,Kiev,UA
150,19.03.22,2022-03-19,3,19,2022,Ukraine,proposed route/outcome unknown,Status: proposed route/outcome unknown; There is also a coordinated route from Bucha to Belohorodka: Bucha - Vorzel - Mykhailivska Rubezhivka - Zabuchye - Dmytrivka - Kapytanivka - Stoyanka - Horenichy - Belohorodka.  see source: https://interfax.com/newsroom/top-stories/77051/?sphrase_id=81981,https://interfax.com/newsroom/top-stories/77051/?sphrase_id=81981,src-2,proposed route/outcome unknown,Stoyanka,,50.45116,30.22691,UA.13,13,Kiev,UA,Belohorodka,,50.3897,30.23087,UA.13,13,Kiev,UA
152,19.03.22,2022-03-19,3,19,2022,Ukraine,proposed route/outcome unknown,"Status: proposed route/outcome unknown; There is a route from Bohdanivka to Brovary, which goes through Nova Bohdanivka - Rudnya - Letky - Rozhny - Pukhovka - Zazimye - Brovary.  see source: https://interfax.com/newsroom/top-stories/77051/?sphrase_id=81981",https://interfax.com/newsroom/top-stories/77051/?sphrase_id=81981,src-4,proposed route/outcome unknown,Bohdanivka,Bohdanivka,49.85,24.43333,UA.15,15,Lviv Oblast,UA,Brovary,Brovary,50.51809,30.80671,UA.13,13,Kiev,UA
153,19.03.22,2022-03-19,3,19,2022,Ukraine,proposed route/outcome unknown,"Status: proposed route/outcome unknown; There is a route from Bohdanivka to Brovary, which goes through Nova Bohdanivka - Rudnya - Letky - Rozhny - Pukhovka - Zazimye - Brovary.  see source: https://interfax.com/newsroom/top-stories/77051/?sphrase_id=81981",https://interfax.com/newsroom/top-stories/77051/?sphrase_id=81981,src-4,proposed route/outcome unknown,Nova Bohdanivka,,50.6476,30.90596,UA.13,13,Kiev,UA,Brovary,Brovary,50.51809,30.80671,UA.13,13,Kiev,UA
154,19.03.22,2022-03-19,3,19,2022,Ukraine,proposed route/outcome unknown,"Status: proposed route/outcome unknown; There is a route from Bohdanivka to Brovary, which goes through Nova Bohdanivka - Rudnya - Letky - Rozhny - Pukhovka - Zazimye - Brovary.  see source: https://interfax.com/newsroom/top-stories/77051/?sphrase_id=81981",https://interfax.com/newsroom/top-stories/77051/?sphrase_id=81981,src-4,proposed route/outcome unknown,Rudnya,Rudnya,51.25,26.6,UA.19,19,Rivne,UA,Brovary,Brovary,50.51809,30.80671,UA.13,13,Kiev,UA
156,19.03.22,2022-03-19,3,19,2022,Ukraine,proposed route/outcome unknown,"Status: proposed route/outcome unknown; There is a route from Bohdanivka to Brovary, which goes through Nova Bohdanivka - Rudnya - Letky - Rozhny - Pukhovka - Zazimye - Brovary.  see source: https://interfax.com/newsroom/top-stories/77051/?sphrase_id=81981",https://interfax.com/newsroom/top-stories/77051/?sphrase_id=81981,src-4,proposed route/outcome unknown,Rozhny,Rozhny,50.6669,30.73503,UA.13,13,Kiev,UA,Brovary,Brovary,50.51809,30.80671,UA.13,13,Kiev,UA
157,19.03.22,2022-03-19,3,19,2022,Ukraine,proposed route/outcome unknown,"Status: proposed route/outcome unknown; There is a route from Bohdanivka to Brovary, which goes through Nova Bohdanivka - Rudnya - Letky - Rozhny - Pukhovka - Zazimye - Brovary.  see source: https://interfax.com/newsroom/top-stories/77051/?sphrase_id=81981",https://interfax.com/newsroom/top-stories/77051/?sphrase_id=81981,src-4,proposed route/outcome unknown,Pukhovka,,50.6097,30.7177,UA.13,13,Kiev,UA,Brovary,Brovary,50.51809,30.80671,UA.13,13,Kiev,UA
158,19.03.22,2022-03-19,3,19,2022,Ukraine,proposed route/outcome unknown,"Status: proposed route/outcome unknown; There is a route from Bohdanivka to Brovary, which goes through Nova Bohdanivka - Rudnya - Letky - Rozhny - Pukhovka - Zazimye - Brovary.  see source: https://interfax.com/newsroom/top-stories/77051/?sphrase_id=81981",https://interfax.com/newsroom/top-stories/77051/?sphrase_id=81981,src-4,proposed route/outcome unknown,Zazimye,,50.56923,30.67319,UA.13,13,Kiev,UA,Brovary,Brovary,50.51809,30.80671,UA.13,13,Kiev,UA
159,19.03.22,2022-03-19,3,19,2022,Ukraine,proposed route/outcome unknown,"Status: proposed route/outcome unknown; The route from Borodynka to Bila Tservka goes through Piskovka, Bila Krynytsa, Kocherov, Brusilov and Fastov.  see source: https://interfax.com/newsroom/top-stories/77051/?sphrase_id=81981",https://interfax.com/newsroom/top-stories/77051/?sphrase_id=81981,src-9,proposed route/outcome unknown,Borodynka,,50.64225,29.91404,UA.13,13,Kiev,UA,Bila Tservka,Bila,48.31803,25.88124,UA.03,3,Chernivtsi Oblast,UA
161,19.03.22,2022-03-19,3,19,2022,Ukraine,proposed route/outcome unknown,"Status: proposed route/outcome unknown; The route from Borodynka to Bila Tservka goes through Piskovka, Bila Krynytsa, Kocherov, Brusilov and Fastov.  see source: https://interfax.com/newsroom/top-stories/77051/?sphrase_id=81981",https://interfax.com/newsroom/top-stories/77051/?sphrase_id=81981,src-9,proposed route/outcome unknown,Bila Krynytsa,Bila,48.31803,25.88124,UA.03,3,Chernivtsi Oblast,UA,Bila Tservka,Bila,48.31803,25.88124,UA.03,3,Chernivtsi Oblast,UA
162,19.03.22,2022-03-19,3,19,2022,Ukraine,proposed route/outcome unknown,"Status: proposed route/outcome unknown; The route from Borodynka to Bila Tservka goes through Piskovka, Bila Krynytsa, Kocherov, Brusilov and Fastov.  see source: https://interfax.com/newsroom/top-stories/77051/?sphrase_id=81981",https://interfax.com/newsroom/top-stories/77051/?sphrase_id=81981,src-9,proposed route/outcome unknown,Kocherov,,50.35885,29.3502,UA.27,27,Zhytomyr,UA,Bila Tservka,Bila,48.31803,25.88124,UA.03,3,Chernivtsi Oblast,UA
163,19.03.22,2022-03-19,3,19,2022,Ukraine,proposed route/outcome unknown,"Status: proposed route/outcome unknown; The route from Borodynka to Bila Tservka goes through Piskovka, Bila Krynytsa, Kocherov, Brusilov and Fastov.  see source: https://interfax.com/newsroom/top-stories/77051/?sphrase_id=81981",https://interfax.com/newsroom/top-stories/77051/?sphrase_id=81981,src-9,proposed route/outcome unknown,Brusilov,,50.28774,29.51185,UA.27,27,Zhytomyr,UA,Bila Tservka,Bila,48.31803,25.88124,UA.03,3,Chernivtsi Oblast,UA
164,19.03.22,2022-03-19,3,19,2022,Ukraine,proposed route/outcome unknown,"Status: proposed route/outcome unknown; The route from Borodynka to Bila Tservka goes through Piskovka, Bila Krynytsa, Kocherov, Brusilov and Fastov.  see source: https://interfax.com/newsroom/top-stories/77051/?sphrase_id=81981",https://interfax.com/newsroom/top-stories/77051/?sphrase_id=81981,src-9,proposed route/outcome unknown,Fastov,,50.06586,29.90439,UA.13,13,Kiev,UA,Bila Tservka,Bila,48.31803,25.88124,UA.03,3,Chernivtsi Oblast,UA
165,19.03.22,2022-03-19,3,19,2022,Ukraine,proposed route/outcome unknown,"Status: proposed route/outcome unknown; In the Luhansk region, there is a route from Lysychansk to Bakhmut and from Sievierodonetsk to Bakhmut: Bakhmut - Lysychansk - Sievierodonetsk.  see source: https://interfax.com/newsroom/top-stories/77051/?sphrase_id=81981",https://interfax.com/newsroom/top-stories/77051/?sphrase_id=81981,src-41,proposed route/outcome unknown,Lysychansk,Lysychansk,48.90421,38.44094,UA.14,14,Luhansk,UA,Bakhmut,Bakhmut,49.15,34.28333,UA.18,18,Poltava Oblast,UA
166,19.03.22,2022-03-19,3,19,2022,Ukraine,proposed route/outcome unknown,"Status: proposed route/outcome unknown; In the Luhansk region, there is a route from Lysychansk to Bakhmut and from Sievierodonetsk to Bakhmut: Bakhmut - Lysychansk - Sievierodonetsk.  see source: https://interfax.com/newsroom/top-stories/77051/?sphrase_id=81981",https://interfax.com/newsroom/top-stories/77051/?sphrase_id=81981,src-41,proposed route/outcome unknown,Sievierodonetsk,Sievierodonetsk,48.94628,38.48624,UA.14,14,Luhansk,UA,Bakhmut,Bakhmut,49.15,34.28333,UA.18,18,Poltava Oblast,UA
167,19.03.22,2022-03-19,3,19,2022,Ukraine,proposed route/outcome unknown,"Status: proposed route/outcome unknown; In the Luhansk region, there is a route from Lysychansk to Bakhmut and from Sievierodonetsk to Bakhmut: Bakhmut - Lysychansk - Sievierodonetsk. There is also a route from Rubizhne to Bakhmut: Bakhmut - Lysychansk - Sievierodonetsk - Rubizhne, and a route from Popasna to Bakhmut and back.  see source: https://interfax.com/newsroom/top-stories/77051/?sphrase_id=81981",https://interfax.com/newsroom/top-stories/77051/?sphrase_id=81981,src-34,proposed route/outcome unknown,Rubizhne,Rubizhne,50.1653,36.82525,UA.07,7,Kharkiv,UA,Bakhmut,Bakhmut,49.15,34.28333,UA.18,18,Poltava Oblast,UA
168,19.03.22,2022-03-19,3,19,2022,Ukraine,proposed route/outcome unknown,"Status: proposed route/outcome unknown; In the Luhansk region, there is a route from Lysychansk to Bakhmut and from Sievierodonetsk to Bakhmut: Bakhmut - Lysychansk - Sievierodonetsk. There is also a route from Rubizhne to Bakhmut: Bakhmut - Lysychansk - Sievierodonetsk - Rubizhne, and a route from Popasna to Bakhmut and back.  see source: https://interfax.com/newsroom/top-stories/77051/?sphrase_id=81981",https://interfax.com/newsroom/top-stories/77051/?sphrase_id=81981,src-34,proposed route/outcome unknown,Popasna,Popasna,48.63328,38.37804,UA.14,14,Luhansk,UA,Bakhmut,Bakhmut,49.15,34.28333,UA.18,18,Poltava Oblast,UA
173,20.03.22,2022-03-20,3,20,2022,Ukraine,successful,"Status: successful; A total of 3,985 people were evacuated from Mariupol to Zaporizhzhya by bus from Berdiansk and by personal transport, she said. ""Tomorrow morning, we plan to send some 50 buses from Zaporizhzhya in the direction of Mariupol,"" Vereshchuk said in a video address on Sunday evening.  see source: https://interfax.com/newsroom/top-stories/77087/?sphrase_id=81981",https://interfax.com/newsroom/top-stories/77087/?sphrase_id=81981,src-171,successful,Mariupol,Mariupol,47.09514,37.54131,UA.05,5,Donetsk Oblast,UA,Zaporizhzhya,Zaporizhzhya,47.85167,35.11714,UA.26,26,Zaporizhzhya Oblast,UA
176,20.03.22,2022-03-20,3,20,2022,Ukraine,successful,"Status: successful; In the Kyiv region, 2,000 people were evacuated from the village of Bobrik to Brovary and 1,130 people were evacuated from Tarasivka to Brovary.  see source: https://interfax.com/newsroom/top-stories/77087/?sphrase_id=81981",https://interfax.com/newsroom/top-stories/77087/?sphrase_id=81981,src-33,successful,Bobrik,Bobrik,51.2,29.6,UA.13,13,Kiev,UA,Brovary,Brovary,50.51809,30.80671,UA.13,13,Kiev,UA
177,20.03.22,2022-03-20,3,20,2022,Ukraine,successful,"Status: successful; In the Kyiv region, 2,000 people were evacuated from the village of Bobrik to Brovary and 1,130 people were evacuated from Tarasivka to Brovary.  see source: https://interfax.com/newsroom/top-stories/77087/?sphrase_id=81981",https://interfax.com/newsroom/top-stories/77087/?sphrase_id=81981,src-33,successful,Tarasivka,Tarasivka,51.5676,33.05113,UA.02,2,Chernihiv,UA,Brovary,Brovary,50.51809,30.80671,UA.13,13,Kiev,UA
